source,service,cve,exploit_prob,target,privilege192.168.254.147,"The LAN-to-LAN IPSEC capability for Cisco VPN 3000 Concentrator 2.2.x, and 3.x before 3.5.4, allows remote attackers to cause a denial of service via an incoming LAN-to-LAN connection with an existing security association with another device on the remote network, which causes the concentrator to remove the previous connection.",CVE-2002-1102,0.00823,192.168.58.129,User
192.168.254.147,L0phtcrack 2.5 used temporary files in the system TEMP directory which could contain password information.,CVE-1999-0458,0.00042,192.168.199.173,User
192.168.254.147,libnss-pgsql in nss-pgsql 0.9.0 and earlier allows remote attackers to execute arbitrary SQL queries by inserting SQL code into an HTTP request.,CVE-2001-1089,0.00696,192.168.199.173,User
192.168.254.147,ROADS search.pl program allows remote attackers to read arbitrary files by specifying the file name in the form parameter and terminating the filename with a null byte.,CVE-2001-0215,0.03572,192.168.199.173,User
192.168.254.147,"GnuPG (gpg) 1.0.3 does not properly check all signatures of a file containing multiple documents, which allows an attacker to modify contents of all documents but the first without detection.",CVE-2000-0974,0.01251,192.168.78.150,User
192.168.254.147,The SSH authentication agent follows symlinks via a UNIX domain socket.,CVE-1999-0787,0.00051,192.168.78.150,User
192.168.254.147,"Cross-site scripting (XSS) vulnerability in Null HTTP Server 0.5.0 and earlier allows remote attackers to insert arbitrary HTML into a ""404 Not Found"" response.",CVE-2002-1497,0.00221,192.168.82.35,User
192.168.254.147,xSANE 0.81 and earlier allows local users to modify files of other xSANE users via a symlink attack on temporary files.,CVE-2001-0887,0.00042,192.168.82.35,User
192.168.254.147,"WebShield SMTP 4.5 allows remote attackers to cause a denial of service by sending e-mail with a From: address that has a . (period) at the end, which causes WebShield to continuously send itself copies of the e-mail.",CVE-2000-0738,0.00521,192.168.82.35,User
192.168.254.147,"Cisco VPN 3000 series concentrators before 2.5.2(F) allow remote attackers to cause a denial of service via a flood of invalid login requests to (1) the SSL service, or (2) the telnet service, which do not properly disconnect the user after several failed login attempts.",CVE-2001-0427,0.00646,192.168.104.122,User
192.168.254.147,getcwd() file descriptor leak in FTP.,CVE-1999-0083,0.00622,192.168.104.122,User
192.168.254.147,Linux apcd program allows local attackers to modify arbitrary files via a symlink attack.,CVE-2000-0107,0.00042,192.168.104.122,User
192.168.254.147,Buffer overflow in Berkeley automounter daemon (amd) logging facility provided in the Linux am-utils package and others.,CVE-1999-0704,0.01003,192.168.104.122,User
192.168.254.147,Buffer overflow in CrackLib 2.5 may allow local users to gain root privileges via a long GECOS field.,CVE-1999-1140,0.00043,192.168.104.122,Root
192.168.254.147,gzexe in the gzip package on Red Hat Linux 5.0 and earlier allows local users to overwrite files of other users via a symlink attack on a temporary file.,CVE-1999-1332,0.00042,192.168.249.119,User
192.168.254.147,"ZoneAlarm 2.1.10 and earlier does not filter UDP packets with a source port of 67, which allows remote attackers to bypass the firewall rules.",CVE-2000-0339,0.02942,192.168.249.119,User
192.168.254.147,Infradig Inframail prior to 3.98a allows a remote attacker to create a denial of service via a malformed POST request which includes a space followed by a large string.,CVE-2001-0377,0.00835,192.168.249.119,User
192.168.254.147,Directory traversal vulnerability in cal_make.pl in PerlCal allows remote attackers to read arbitrary files via a .. (dot dot) in the p0 parameter.,CVE-2001-0463,0.00894,192.168.249.119,User
192.168.254.147,AppleShare IP 6.1 and later allows a remote attacker to read potentially sensitive information via an invalid range request to the web server.,CVE-2000-0346,0.00224,192.168.87.232,User
192.168.254.147,"Buffer overflow in AOLserver 3.0 allows remote attackers to cause a denial of service, and possibly execute arbitrary code, via an HTTP request with a long Authorization header.",CVE-2001-1067,0.02158,192.168.87.232,User
192.168.254.147,"vim (aka gvim) allows local users to modify files being edited by other users via a symlink attack on the backup and swap files, when the victim is editing the file in a world writable directory.",CVE-2001-0409,0.00042,192.168.87.232,User
192.168.254.147,htmlscript CGI program allows remote read access to files.,CVE-1999-0264,0.00613,192.168.87.232,User
192.168.199.173,"ZoneAlarm 2.1.10 and earlier does not filter UDP packets with a source port of 67, which allows remote attackers to bypass the firewall rules.",CVE-2000-0339,0.02942,192.168.78.150,User
192.168.199.173,"An SSH 1.2.27 server allows a client to use the ""none"" cipher, even if it is not allowed by the server policy.",CVE-1999-1010,0.00042,192.168.78.150,User
192.168.199.173,Buffer overflow in SysVInit in Red Hat Linux 5.1 and earlier allows local users to gain privileges.,CVE-1999-1329,0.00045,192.168.78.150,User
192.168.199.173,Buffer overflow in Novell GroupWise 6.0.1 Support Pack 1 allows remote attackers to execute arbitrary code via a long RCPT TO command.,CVE-2002-1088,0.05255,192.168.78.150,User
192.168.199.173,Lynx allows a local user to overwrite sensitive files through /tmp symlinks.,CVE-1999-0371,0.00042,192.168.58.129,User
192.168.199.173,Cross-site scripting vulnerability in the mini-browser for Winamp 2.78 and 2.79 allows remote attackers to execute script via an ID3v1 or ID3v2 tag in an MP3 file.,CVE-2002-0546,0.01056,192.168.58.129,User
192.168.199.173,"The HTTP server in Cisco 7xx series routers 3.2 through 4.2 is enabled by default, which allows remote attackers to change the router's configuration.",CVE-1999-0415,0.00677,192.168.82.35,User
192.168.199.173,A remote attacker can read information from a Netscape user's cache via JavaScript.,CVE-1999-0790,0.00788,192.168.82.35,User
192.168.199.173,SQL injection vulnerability in the PostgreSQL auth module for courier 0.40 and earlier allows remote attackers to execute SQL code via the user name.,CVE-2003-0040,0.00258,192.168.104.122,User
192.168.199.173,Buffer overflow in the Window.External function in the JScript Scripting Engine in Internet Explorer 4.01 SP1 and earlier allows remote attackers to execute arbitrary commands via a malicious web page.,CVE-1999-1093,0.00282,192.168.104.122,User
192.168.199.173,The NSAPI plugins for TGA and the Java Servlet proxy in HP-UX VVOS 10.24 and 11.04 allows an attacker to cause a denial of service (high CPU utilization).,CVE-2000-0965,0.0012,192.168.104.122,User
192.168.199.173,The web-based folder display capability in Microsoft Internet Explorer 5.5 on Windows 98 allows local users to insert Trojan horse programs by modifying the Folder.htt file and using the InvokeVerb method in the ShellDefView ActiveX control to specify a default execute option for the first file that is listed in the folder.,CVE-2000-0790,0.00044,192.168.104.122,User
192.168.199.173,"The Microsoft Jet database engine allows an attacker to modify text files via a database query, aka the ""Text I-ISAM"" vulnerability.",CVE-2000-0323,0.01282,192.168.254.147,User
192.168.199.173,Buffer overflow in the automatic mail checking component of Pine 4.21 and earlier allows remote attackers to execute arbitrary commands via a long From: header.,CVE-2000-0909,0.04619,192.168.254.147,User
192.168.199.173,Buffer overflow in the get_origin function in traceroute-nanog allows attackers to execute arbitrary code via long WHOIS responses.,CVE-2002-1364,0.00212,192.168.254.147,User
192.168.199.173,"Microsoft Windows 2000 running the Terminal Server 90-day trial version, and possibly other versions, does not apply group policies to incoming users when the number of connections to the SYSVOL share exceeds the maximum, e.g. with a maximum number of licenses, which can allow remote authenticated users to bypass group policies.",CVE-2002-0444,0.0138,192.168.254.147,User
192.168.199.173,"3COM OfficeConnect 812 and 840 ADSL Router 4.2, running OCR812 router software 1.1.9 and earlier, allows remote attackers to cause a denial of service via a long string containing a large number of ""%s"" strings, possibly triggering a format string vulnerability.",CVE-2001-0740,0.02579,192.168.254.147,User
192.168.199.173,PASV core dump in wu-ftpd daemon when attacker uses a QUOTE PASV command after specifying a username and password.,CVE-1999-0075,0.01598,192.168.253.211,User
192.168.199.173,Buffer overflow in the automatic mail checking component of Pine 4.21 and earlier allows remote attackers to execute arbitrary commands via a long From: header.,CVE-2000-0909,0.04619,192.168.253.211,User
192.168.199.173,"Cross-site scripting (XSS) vulnerability in Null HTTP Server 0.5.0 and earlier allows remote attackers to insert arbitrary HTML into a ""404 Not Found"" response.",CVE-2002-1497,0.00221,192.168.253.211,User
192.168.199.173,"Allaire JRun 3.0 http servlet server allows remote attackers to cause a denial of service via a URL that contains a long string of ""."" characters.",CVE-2000-1049,0.00994,192.168.253.211,User
192.168.199.173,Format string vulnerability in screen 3.9.5 and earlier allows local users to gain root privileges via format characters in the vbell_msg initialization variable.,CVE-2000-0901,0.00042,192.168.136.245,Root
192.168.199.173,Buffer overflow in WebShield SMTP 4.5.44 allows remote attackers to execute arbitrary commands via a long configuration parameter to the WebShield remote management service.,CVE-2000-0447,0.00678,192.168.136.245,User
192.168.199.173,"Expreserve, as used in vi and ex, allows local users to overwrite arbitrary files and gain root access.",CVE-1999-0132,0.00065,192.168.136.245,Root
192.168.199.173,"csSearch.cgi in csSearch 2.3 and earlier allows remote attackers to execute arbitrary Perl code via the savesetup command and the setup parameter, which overwrites the setup.cgi configuration file that is loaded by csSearch.cgi.",CVE-2002-0495,0.02649,192.168.136.245,User
192.168.199.173,login in Slackware 7.0 allows remote attackers to identify valid users on the system by reporting an encryption error when an account is locked or does not exist.,CVE-1999-0856,0.00221,192.168.136.245,User
192.168.199.173,"Sdbsearch.cgi in SuSE Linux 6.0-7.2 could allow remote attackers to execute arbitrary commands by uploading a keylist.txt file that contains filenames with shell metacharacters, then causing the file to be searched using a .. in the HTTP referer (from the HTTP_REFERER variable) to point to the directory that contains the keylist.txt file.",CVE-2001-1130,0.04694,192.168.87.232,User
192.168.199.173,"Race condition in signal handling of procmail 3.20 and earlier, when running setuid, allows local users to cause a denial of service or gain root privileges by sending a signal while a signal handling routine is already running.",CVE-2001-0905,0.00042,192.168.87.232,Root
192.168.199.173,Windows NT 4.0 SP4 and earlier allows local users to gain privileges by modifying the symbolic link table in the \?? object folder using a different case letter (upper or lower) to point to a different device.,CVE-1999-1317,0.00044,192.168.87.232,User
192.168.199.173,"Directory traversal vulnerability in IBM Tivoli WebSEAL Policy Director 3.01 through 3.7.1 allows remote attackers to read arbitrary files or directories via encoded .. (dot dot) sequences containing ""%2e"" strings.",CVE-2001-0982,0.00615,192.168.6.130,User
192.168.199.173,Directory traversal vulnerability in emumail.cgi in EMU Webmail 4.5.x and 5.1.0 allows remote attackers to read arbitrary files or list arbitrary directories via a .. (dot dot) in the type parameter.,CVE-2002-0531,0.00321,192.168.6.130,User
192.168.199.173,"SNMP service in Atmel 802.11b VNET-B Access Point 1.3 and earlier, as used in Netgear ME102 and Linksys WAP11, accepts arbitrary community strings with requested MIB modifications, which allows remote attackers to obtain sensitive information such as WEP keys, cause a denial of service, or gain access to the network.",CVE-2001-0514,0.00865,192.168.6.130,User
192.168.199.173,"Debugging utility in the backdoor mode of Palm OS 3.5.2 and earlier allows attackers with physical access to a Palm device to bypass access restrictions and obtain passwords, even if the system lockout mechanism is enabled.",CVE-2001-0157,0.00145,192.168.6.130,User
192.168.199.173,"In Linux before version 2.0.36, remote attackers can spoof a TCP connection and pass data to the application layer before fully establishing the connection.",CVE-1999-0414,0.00756,192.168.6.130,User
192.168.199.173,Buffer overflow in Novell GroupWise 6.0.1 Support Pack 1 allows remote attackers to execute arbitrary code via a long RCPT TO command.,CVE-2002-1088,0.05255,192.168.249.119,User
192.168.199.173,procfs in BSD systems allows local users to gain root privileges by modifying the /proc/pid/mem interface via a modified file descriptor for stderr.,CVE-2000-0094,0.00042,192.168.249.119,Root
192.168.199.173,"The LAN-to-LAN IPSEC capability for Cisco VPN 3000 Concentrator 2.2.x, and 3.x before 3.5.4, allows remote attackers to cause a denial of service via an incoming LAN-to-LAN connection with an existing security association with another device on the remote network, which causes the concentrator to remove the previous connection.",CVE-2002-1102,0.00823,192.168.249.119,User
192.168.199.173,Denial of service in AIX telnet can freeze a system and prevent users from accessing the server.,CVE-1999-0087,0.04674,192.168.249.119,User
192.168.249.119,gzexe in the gzip package on Red Hat Linux 5.0 and earlier allows local users to overwrite files of other users via a symlink attack on a temporary file.,CVE-1999-1332,0.00042,192.168.254.147,User
192.168.249.119,"Heap-based buffer overflow in Fetchmail 6.1.3 and earlier does not account for the ""@"" character when determining buffer lengths for local addresses, which allows remote attackers to execute arbitrary code via a header with a large number of local addresses.",CVE-2002-1365,0.30545,192.168.254.147,User
192.168.249.119,Buffer overflow in the HTML parser for Netscape 4.75 and earlier allows remote attackers to execute arbitrary commands via a long password value in a form field.,CVE-2000-1187,0.00936,192.168.254.147,User
192.168.249.119,Windows NT 4.0 SP4 and earlier allows local users to gain privileges by modifying the symbolic link table in the \?? object folder using a different case letter (upper or lower) to point to a different device.,CVE-1999-1317,0.00044,192.168.254.147,User
192.168.249.119,"Oracle 9i Application Server 1.0.2 allows remote attackers to obtain the physical path of a file under the server root via a request for a non-existent .JSP file, which leaks the pathname in an error message.",CVE-2001-1372,0.10945,192.168.78.150,Root
192.168.249.119,Directory traversal vulnerability in Extent RBS ISP web server allows remote attackers to read sensitive information via a .. (dot dot) attack on the Image parameter.,CVE-2000-1036,0.01215,192.168.78.150,User
192.168.249.119,A remote attacker can read information from a Netscape user's cache via JavaScript.,CVE-1999-0790,0.00788,192.168.87.232,User
192.168.249.119,"crontab by Paul Vixie uses predictable file names for a temporary file and does not properly ensure that the file is owned by the user executing the crontab -e command, which allows local users with write access to the crontab spool directory to execute arbitrary commands by creating world-writeable temporary files and modifying them while the victim is editing the file.",CVE-2000-1096,0.00042,192.168.87.232,User
192.168.249.119,"ISC BIND 9 before 9.2.1 allows remote attackers to cause a denial of service (shutdown) via a malformed DNS packet that triggers an error condition that is not properly handled when the rdataset parameter to the dns_message_findtype() function in message.c is not NULL, aka DoS_findtype.",CVE-2002-0400,0.11226,192.168.87.232,User
192.168.249.119,Multilink PPP for ISDN dialup users in Ascend before 4.6 allows remote attackers to cause a denial of service via a spoofed endpoint identifier.,CVE-1999-1203,0.01179,192.168.82.35,User
192.168.249.119,"WFTPD 3.00 allows remote attackers to read arbitrary files by uploading a (link) file that ends in a "".lnk."" extension, which bypasses WFTPD's check for a "".lnk"" extension.",CVE-2001-1386,0.00343,192.168.82.35,User
192.168.249.119,shadow package in SuSE 8.0 allows local users to destroy the /etc/passwd and /etc/shadow files or assign extra group privileges to some users by changing filesize limits before calling programs that modify the files.,CVE-2002-0762,0.00042,192.168.136.245,User
192.168.249.119,htmlscript CGI program allows remote read access to files.,CVE-1999-0264,0.00613,192.168.136.245,User
192.168.249.119,"Microsoft Virtual Machine (VM) up to and including build 5.0.3805 allows remote attackers to cause a denial of service (crash) in Internet Explorer via invalid handle data in a Java applet, aka ""Handle Validation Flaw.""",CVE-2002-0867,0.01115,192.168.199.173,User
192.168.249.119,The Web interface to Cisco 600 routers running CBOS 2.4.1 and earlier allow remote attackers to cause a denial of service via a URL that does not end in a space character.,CVE-2001-0058,0.00867,192.168.199.173,User
192.168.249.119,"The snprintf function in the db library 1.85.4 ignores the size parameter, which could allow attackers to exploit buffer overflows that would be prevented by a properly implemented snprintf.",CVE-1999-1330,0.00059,192.168.199.173,User
192.168.249.119,mSQL v2.0.1 and below allows remote execution through a buffer overflow.,CVE-1999-0276,0.01598,192.168.253.211,User
192.168.249.119,"IRIX soundplayer program allows local users to gain privileges by including shell metacharacters in a .wav file, which is executed via the midikeys program.",CVE-2000-0013,0.00042,192.168.253.211,User
192.168.249.119,Off-by-one error in the channel code of OpenSSH 2.0 through 3.0.2 allows local users or remote malicious servers to gain privileges.,CVE-2002-0083,0.00871,192.168.6.130,User
192.168.249.119,"The LAN-to-LAN IPSEC capability for Cisco VPN 3000 Concentrator 2.2.x, and 3.x before 3.5.4, allows remote attackers to cause a denial of service via an incoming LAN-to-LAN connection with an existing security association with another device on the remote network, which causes the concentrator to remove the previous connection.",CVE-2002-1102,0.00823,192.168.6.130,User
192.168.249.119,NTMail 5.x allows network users to bypass the NTMail proxy restrictions by redirecting their requests to NTMail's web configuration server.,CVE-2000-0416,0.01096,192.168.104.122,User
192.168.249.119,gzexe in the gzip package on Red Hat Linux 5.0 and earlier allows local users to overwrite files of other users via a symlink attack on a temporary file.,CVE-1999-1332,0.00042,192.168.104.122,User
192.168.249.119,getcwd() file descriptor leak in FTP.,CVE-1999-0083,0.00622,192.168.58.129,User
192.168.249.119,Buffer overflow in Berkeley automounter daemon (amd) logging facility provided in the Linux am-utils package and others.,CVE-1999-0704,0.01003,192.168.58.129,User
192.168.249.119,"A cross-site scripting vulnerability in Caucho Technology Resin before 1.2.4 allows a malicious webmaster to embed Javascript in a hyperlink that ends in a .jsp extension, which causes an error message that does not properly quote the Javascript.",CVE-2001-0828,0.00991,192.168.58.129,User
192.168.249.119,Buffer overflow in the index menu code (menu_pad_string of menu.c) for Mutt 1.4.1 and earlier allows remote attackers to cause a denial of service (crash) and possibly execute arbitrary code via certain mail messages.,CVE-2004-0078,0.0866,192.168.58.129,User
192.168.78.150,Buffer overflow in dlvr_audit for Caldera OpenServer 5.0.5 and 5.0.6 allows local users to gain root privileges.,CVE-2002-0442,0.00042,192.168.199.173,Root
192.168.78.150,Format string vulnerability in RPC wall daemon (rpc.rwalld) for Solaris 2.5.1 through 8 allows remote attackers to execute arbitrary code via format strings in a message that is not properly provided to the syslog function when the wall command cannot be executed.,CVE-2002-0573,0.82733,192.168.199.173,User
192.168.78.150,The web-based folder display capability in Microsoft Internet Explorer 5.5 on Windows 98 allows local users to insert Trojan horse programs by modifying the Folder.htt file and using the InvokeVerb method in the ShellDefView ActiveX control to specify a default execute option for the first file that is listed in the folder.,CVE-2000-0790,0.00044,192.168.87.232,User
192.168.78.150,"In Linux before version 2.0.36, remote attackers can spoof a TCP connection and pass data to the application layer before fully establishing the connection.",CVE-1999-0414,0.00756,192.168.87.232,User
192.168.78.150,"The dbm and shm session cache code in mod_ssl before 2.8.7-1.3.23, and Apache-SSL before 1.3.22+1.46, does not properly initialize memory using the i2d_SSL_SESSION function, which allows remote attackers to use a buffer overflow to execute arbitrary code via a large client certificate that is signed by a trusted Certificate Authority (CA), which produces a large serialized session.",CVE-2002-0082,0.47589,192.168.87.232,User
192.168.78.150,The #sinclude directive in Embedded Perl (ePerl) 2.2.14 and earlier allows a remote attacker to execute arbitrary code by modifying the 'sinclude' file to point to another file that contains a #include directive that references a file that contains the code.,CVE-2001-0733,0.01925,192.168.87.232,User
192.168.58.129,Livingston portmaster machines could be rebooted via a series of commands.,CVE-1999-0218,0.03841,192.168.249.119,User
192.168.58.129,Buffer overflow in the HTML parser for Netscape 4.75 and earlier allows remote attackers to execute arbitrary commands via a long password value in a form field.,CVE-2000-1187,0.00936,192.168.249.119,User
192.168.58.129,"Recourse ManTrap 1.6 sets up a chroot environment to hide the fact that it is running, but the inode number for the resulting ""/"" file system is higher than normal, which allows attackers to determine that they are in a chroot environment.",CVE-2000-1144,0.00074,192.168.78.150,Root
192.168.58.129,"The default configuration of Big Brother 1.4h2 and earlier does not include proper access restrictions, which allows remote attackers to execute arbitrary commands by using bbd to upload a file whose extension will cause it to be executed as a CGI script by the web server.",CVE-2000-0639,0.01002,192.168.78.150,User
192.168.58.129,Buffer overflow in Berkeley automounter daemon (amd) logging facility provided in the Linux am-utils package and others.,CVE-1999-0704,0.01003,192.168.78.150,User
192.168.58.129,"Insecure file permissions for Netscape FastTrack Server 2.x, Enterprise Server 2.0, and Proxy Server 2.5 in SCO UnixWare 7.0.x and 2.1.3 allow an attacker to gain root privileges.",CVE-2000-0308,0.00192,192.168.78.150,Root
192.168.58.129,"The default configuration of Big Brother 1.4h2 and earlier does not include proper access restrictions, which allows remote attackers to execute arbitrary commands by using bbd to upload a file whose extension will cause it to be executed as a CGI script by the web server.",CVE-2000-0639,0.01002,192.168.78.150,User
192.168.58.129,Information from SSL-encrypted sessions via PKCS #1.,CVE-1999-0007,0.00073,192.168.199.173,User
192.168.58.129,Remote attackers can cause a denial of service in Sendmail 8.8.x and 8.9.2 by sending messages with a large number of headers.,CVE-1999-0393,0.00849,192.168.199.173,User
192.168.58.129,Buffer overflow in Solaris x86 mkcookie allows local users to obtain root access.,CVE-1999-0139,0.00044,192.168.199.173,Root
192.168.58.129,The DocumentTemplate package in Zope 2.2 and earlier allows a remote attacker to modify DTMLDocuments or DTMLMethods without authorization.,CVE-2000-0483,0.01598,192.168.199.173,User
192.168.58.129,"Cisco Virtual Private Network (VPN) Client software 2.x.x, and 3.x before 3.5.1C, does not properly verify that certificate DN fields match those of the certificate from the VPN Concentrator, which allows remote attackers to conduct man-in-the-middle attacks.",CVE-2002-1106,0.0036,192.168.199.173,User
