source,service,cve,exploit_prob,target,privilege
192.168.85.204,login in Slackware 7.0 allows remote attackers to identify valid users on the system by reporting an encryption error when an account is locked or does not exist.,CVE-1999-0856,0.00221,192.168.44.7,User
192.168.85.204,Buffer overflow in WebShield SMTP 4.5.44 allows remote attackers to execute arbitrary commands via a long configuration parameter to the WebShield remote management service.,CVE-2000-0447,0.00678,192.168.44.7,User
192.168.85.204,"Courier sqwebmail before 0.40.0 does not quickly drop privileges after startup in certain cases, which could allow local users to read arbitrary files.",CVE-2002-1311,0.00042,192.168.44.7,User
192.168.42.25,"The SPP_VerifyPVV function in nCipher payShield SPP library 1.3.12, 1.5.18 and 1.6.18 returns a Status_OK value even if the HSM returns a different status code, which could cause applications to make incorrect security-critical decisions, e.g. by accepting an invalid PIN number.",CVE-2004-0063,0.00486,192.168.85.204,User
192.168.42.25,"crontab in Vixie cron 3.0.1 and earlier does not properly drop privileges after the failed parsing of a modification operation, which could allow a local attacker to gain additional privileges when an editor is called to correct the error.",CVE-2001-0559,0.00042,192.168.85.204,User
192.168.42.25,InterScan VirusWall SMTP scanner does not properly scan messages with malformed attachments.,CVE-2000-0033,0.0222,192.168.85.204,User
192.168.42.25,AIX piodmgrsu command allows local users to gain additional group privileges.,CVE-1999-0094,0.00042,192.168.85.204,User
192.168.42.25,"Internet Explorer 5.01 and earlier allows a remote attacker to create a reference to a client window and use a server-side redirect to access local files via that window, aka ""Server-side Page Reference Redirect.""",CVE-1999-0981,0.00806,192.168.85.204,User
192.168.167.78,Maxum Rumpus FTP Server 1.3.3 and 2.0.3 dev 3 allows a remote attacker to perform a denial of service (hang) by creating a directory name of a specific length.,CVE-2001-0646,0.0116,192.168.65.228,User
192.168.167.78,The web-based folder display capability in Microsoft Internet Explorer 5.5 on Windows 98 allows local users to insert Trojan horse programs by modifying the Folder.htt file and using the InvokeVerb method in the ShellDefView ActiveX control to specify a default execute option for the first file that is listed in the folder.,CVE-2000-0790,0.00044,192.168.65.228,User
192.168.167.78,NTMail 5.x allows network users to bypass the NTMail proxy restrictions by redirecting their requests to NTMail's web configuration server.,CVE-2000-0416,0.01096,192.168.65.228,User
192.168.167.78,Buffer overflow in calserver in SCO OpenServer allows remote attackers to gain root access via a long message.,CVE-2000-0306,0.02452,192.168.65.228,Root
192.168.167.78,Lmail 2.7 and earlier allows local users to overwrite arbitrary files via a symlink attack on a temporary file.,CVE-2001-1085,0.00042,192.168.65.228,User
192.168.167.78,"Cisco VPN 3000 series concentrators before 2.5.2(F) allow remote attackers to cause a denial of service via a flood of invalid login requests to (1) the SSL service, or (2) the telnet service, which do not properly disconnect the user after several failed login attempts.",CVE-2001-0427,0.00646,192.168.65.228,User
192.168.167.78,Windows NT 4.0 SP4 and earlier allows local users to gain privileges by modifying the symbolic link table in the \?? object folder using a different case letter (upper or lower) to point to a different device.,CVE-1999-1317,0.00044,192.168.65.228,User
192.168.167.78,Directory traversal vulnerability in McAfee ASaP VirusScan agent 1.0 allows remote attackers to read arbitrary files via a .. (dot dot) in the HTTP request.,CVE-2001-1144,0.01439,192.168.94.211,User
192.168.167.78,"Identix BioLogon 2.03 and earlier does not lock secondary displays on a multi-monitor system running Windows 98 or ME, which allows an attacker with physical access to the system to bypass authentication through a secondary display.",CVE-2001-1116,0.00148,192.168.94.211,User
192.168.167.78,Buffer overflow in INN 2.2.1 and earlier allows remote attackers to cause a denial of service via a maliciously formatted article.,CVE-2000-0360,0.00649,192.168.94.211,User
192.168.167.78,UnixWare uidadmin allows local users to modify arbitrary files via a symlink attack.,CVE-1999-0836,0.0016,192.168.94.211,User
192.168.167.78,"Cross-site scripting (XSS) vulnerability in Null HTTP Server 0.5.0 and earlier allows remote attackers to insert arbitrary HTML into a ""404 Not Found"" response.",CVE-2002-1497,0.00221,192.168.94.211,User
192.168.167.78,"Race condition in signal handling of procmail 3.20 and earlier, when running setuid, allows local users to cause a denial of service or gain root privileges by sending a signal while a signal handling routine is already running.",CVE-2001-0905,0.00042,192.168.94.211,Root
192.168.167.78,Cross-site scripting vulnerability in the mini-browser for Winamp 2.78 and 2.79 allows remote attackers to execute script via an ID3v1 or ID3v2 tag in an MP3 file.,CVE-2002-0546,0.01056,192.168.94.211,User
192.168.167.78,"The LAN-to-LAN IPSEC capability for Cisco VPN 3000 Concentrator 2.2.x, and 3.x before 3.5.4, allows remote attackers to cause a denial of service via an incoming LAN-to-LAN connection with an existing security association with another device on the remote network, which causes the concentrator to remove the previous connection.",CVE-2002-1102,0.00823,192.168.85.204,User
192.168.167.78,"Auction Weaver 1.0 through 1.04 does not properly validate the names of form fields, which allows remote attackers to delete arbitrary files and directories via a .. (dot dot) attack.",CVE-2000-0810,0.01221,192.168.85.204,User
192.168.167.78,"A cross-site scripting vulnerability in Caucho Technology Resin before 1.2.4 allows a malicious webmaster to embed Javascript in a hyperlink that ends in a .jsp extension, which causes an error message that does not properly quote the Javascript.",CVE-2001-0828,0.00991,192.168.85.204,User
192.168.167.78,"An SSH 1.2.27 server allows a client to use the ""none"" cipher, even if it is not allowed by the server policy.",CVE-1999-1010,0.00042,192.168.85.204,User
192.168.167.78,"WFTPD 3.00 allows remote attackers to read arbitrary files by uploading a (link) file that ends in a "".lnk."" extension, which bypasses WFTPD's check for a "".lnk"" extension.",CVE-2001-1386,0.00343,192.168.85.204,User
192.168.167.78,"cmd5checkpw 0.21 and earlier allows remote attackers to cause a denial of service via an ""SMTP AUTH"" command with an unknown username.",CVE-2000-0990,0.00776,192.168.42.25,User
192.168.167.78,"WebShield SMTP 4.5 allows remote attackers to cause a denial of service by sending e-mail with a From: address that has a . (period) at the end, which causes WebShield to continuously send itself copies of the e-mail.",CVE-2000-0738,0.00521,192.168.42.25,User
192.168.167.78,"The campas CGI program provided with some NCSA web servers allows an attacker to execute arbitrary commands via encoded carriage return characters in the query string, as demonstrated by reading the password file.",CVE-1999-0146,0.06359,192.168.42.25,User
192.168.167.78,"Vulnerability in inetd server in HP-UX 11.04 and earlier allows attackers to cause a denial of service when the ""swait"" state is used by a server.",CVE-2001-0106,0.0012,192.168.42.25,User
192.168.167.78,"Debugging utility in the backdoor mode of Palm OS 3.5.2 and earlier allows attackers with physical access to a Palm device to bypass access restrictions and obtain passwords, even if the system lockout mechanism is enabled.",CVE-2001-0157,0.00145,192.168.42.25,User
192.168.167.78,htmlscript CGI program allows remote read access to files.,CVE-1999-0264,0.00613,192.168.42.25,User
192.168.167.78,Buffer overflow in NCSA HTTP daemon v1.3 allows remote command execution.,CVE-1999-0267,0.00599,192.168.117.11,User
192.168.167.78,IBM Network Station Manager NetStation allows local users to gain privileges via a symlink attack.,CVE-2000-0027,0.00042,192.168.117.11,User
192.168.167.78,Buffer overflow in Webstar HTTP server allows remote attackers to cause a denial of service via a long GET request.,CVE-2000-0290,0.01179,192.168.117.11,User
192.168.167.78,IBM Network Station Manager NetStation allows local users to gain privileges via a symlink attack.,CVE-2000-0027,0.00042,192.168.117.11,User
192.168.167.78,Cross-site scripting vulnerability in the mini-browser for Winamp 2.78 and 2.79 allows remote attackers to execute script via an ID3v1 or ID3v2 tag in an MP3 file.,CVE-2002-0546,0.01056,192.168.117.11,User
192.168.167.78,IRC Xchat client versions 1.4.2 and earlier allows remote attackers to execute arbitrary commands by encoding shell metacharacters into a URL which XChat uses to launch a web browser.,CVE-2000-0787,0.10989,192.168.117.11,User
192.168.167.78,Buffer overflow in POP servers based on BSD/Qualcomm's qpopper allows remote attackers to gain root access using a long PASS command.,CVE-1999-0006,0.03341,192.168.117.11,Root
192.168.167.78,Memory leak in Terminal servers in Windows NT and Windows 2000 allows remote attackers to cause a denial of service (memory exhaustion) via a large number of malformed Remote Desktop Protocol (RDP) requests to port 3389.,CVE-2001-0540,0.02583,192.168.20.218,User
192.168.167.78,"Portable Network Graphics (PNG) library libpng 1.2.5 and earlier does not correctly calculate offsets, which allows remote attackers to cause a denial of service (crash) and possibly execute arbitrary code via a buffer overflow attack on the row buffers.",CVE-2002-1363,0.10285,192.168.20.218,User
192.168.167.78,Windows NT 4.0 SP4 and earlier allows local users to gain privileges by modifying the symbolic link table in the \?? object folder using a different case letter (upper or lower) to point to a different device.,CVE-1999-1317,0.00044,192.168.20.218,User
192.168.167.78,Buffer overflow in dlvr_audit for Caldera OpenServer 5.0.5 and 5.0.6 allows local users to gain root privileges.,CVE-2002-0442,0.00042,192.168.20.218,Root
192.168.167.78,"Buffer overflow in Sendmail before 8.12.5, when configured to use a custom DNS map to query TXT records, allows remote attackers to cause a denial of service and possibly execute arbitrary code via a malicious DNS server.",CVE-2002-0906,0.058,192.168.20.218,User
192.168.167.78,"Cross-site scripting vulnerability in analog before 5.22 allows remote attackers to execute Javascript via an HTTP request containing the script, which is entered into a web logfile and not properly filtered by analog during display.",CVE-2002-0166,0.01854,192.168.150.103,User
192.168.167.78,"IIS 4.0 and 5.0 allows remote attackers to read documents outside of the web root, and possibly execute arbitrary commands, via malformed URLs that contain UNICODE encoded characters, aka the ""Web Server Folder Traversal"" vulnerability.",CVE-2000-0884,0.93793,192.168.150.103,Root
192.168.167.78,"sendmessage.cgi in W3Mail 1.0.2, and possibly other CGI programs, allows remote attackers to execute arbitrary commands via shell metacharacters in any field of the 'Compose Message' page.",CVE-2001-1100,0.01582,192.168.150.103,User
192.168.167.78,"An input validation error in the Sun Microsystems RPC library Services for Unix 3.0 Interix SD, as implemented on Microsoft Windows NT4, 2000, and XP, allows remote attackers to cause a denial of service via malformed fragmented RPC client packets, aka ""Denial of service by sending an invalid RPC request.""",CVE-2002-1141,0.00901,192.168.150.103,User
192.168.167.78,The handle_var_requests function in snmp_agent.c for the SNMP daemon in the Net-SNMP (formerly ucd-snmp) package 5.0.1 through 5.0.5 allows remote attackers to cause a denial of service (crash) via a NULL dereference.,CVE-2002-1170,0.01536,192.168.150.103,User
192.168.167.78,Livingston portmaster machines could be rebooted via a series of commands.,CVE-1999-0218,0.03841,192.168.150.103,User
192.168.167.78,The Web interface to Cisco 600 routers running CBOS 2.4.1 and earlier allow remote attackers to cause a denial of service via a URL that does not end in a space character.,CVE-2001-0058,0.00867,192.168.150.103,User
192.168.167.78,PASV core dump in wu-ftpd daemon when attacker uses a QUOTE PASV command after specifying a username and password.,CVE-1999-0075,0.01598,192.168.150.103,User
192.168.167.78,"vim (aka gvim) allows local users to modify files being edited by other users via a symlink attack on the backup and swap files, when the victim is editing the file in a world writable directory.",CVE-2001-0409,0.00042,192.168.252.190,User
192.168.167.78,Microsoft SQL Server 2000 allows remote attackers to cause a denial of service via a malformed 0x08 packet that is missing a colon separator.,CVE-2002-0729,0.00817,192.168.252.190,User
192.168.167.78,Vulnerability in the cache-limiting function of the unified name service daemon (nsd) in IRIX 6.5.4 through 6.5.11 allows remote attackers to cause a denial of service by forcing the cache to fill the disk.,CVE-2002-0038,0.01301,192.168.252.190,User
192.168.167.78,"Windows NT 4.0 allows local users to cause a denial of service via a user mode application that closes a handle that was opened in kernel mode, which causes a crash when the kernel attempts to close the handle.",CVE-1999-1360,0.00045,192.168.252.190,User
192.168.167.78,"The COM_CHANGE_USER command in MySQL 3.x before 3.23.54, and 4.x to 4.0.6, allows remote attackers to execute arbitrary code via a long response.",CVE-2002-1375,0.12852,192.168.252.190,User
192.168.252.190,IRC Xchat client versions 1.4.2 and earlier allows remote attackers to execute arbitrary commands by encoding shell metacharacters into a URL which XChat uses to launch a web browser.,CVE-2000-0787,0.10989,192.168.167.78,User
192.168.252.190,Buffer overflow in INN 2.2.1 and earlier allows remote attackers to cause a denial of service via a maliciously formatted article.,CVE-2000-0360,0.00649,192.168.167.78,User
192.168.252.190,"Common Unix Printing System (CUPS) 1.1.14 through 1.1.17 does not properly check the return values of various file and socket operations, which could allow a remote attacker to cause a denial of service (resource exhaustion) by causing file descriptors to be assigned and not released, as demonstrated by fanta.",CVE-2002-1372,0.01398,192.168.167.78,User
192.168.252.190,"Heap corruption vulnerability in the ""at"" program allows local users to execute arbitrary code via a malformed execution time, which causes at to free the same memory twice.",CVE-2002-0004,0.00042,192.168.167.78,User
192.168.252.190,IIS 4.0 with URL redirection enabled allows remote attackers to cause a denial of service (crash) via a malformed request that specifies a length that is different than the actual length.,CVE-2001-0545,0.81318,192.168.167.78,User
192.168.252.190,"The Vicam USB driver in Linux before 2.4.25 does not use the copy_from_user function when copying data from userspace to kernel space, which crosses security boundaries and allows local users to cause a denial of service.",CVE-2004-0075,0.0006,192.168.167.78,User
192.168.252.190,Vulnerability in (1) Microsoft Excel 2002 and earlier and (2) Microsoft PowerPoint 2002 and earlier allows attackers to bypass macro restrictions and execute arbitrary commands by modifying the data stream in the document.,CVE-2001-0718,0.00644,192.168.167.78,User
192.168.252.190,"JRun 3.0 through 4.0 allows remote attackers to read JSP source code via an encoded null byte in an HTTP GET request, which causes the server to send the .JSP file unparsed.",CVE-2002-1025,0.00674,192.168.167.78,User
192.168.252.190,AppleShare IP 6.1 and later allows a remote attacker to read potentially sensitive information via an invalid range request to the web server.,CVE-2000-0346,0.00224,192.168.42.25,User
192.168.252.190,"The libCheckSignature function in crypto-utils.lib for OpenCA 0.9.1.6 and earlier only compares the serial of the signer's certificate and the one in the database, which can cause OpenCA to incorrectly accept a signature if the certificate's chain is trusted by OpenCA's chain directory, allowing remote attackers to spoof requests from other users.",CVE-2004-0004,0.01811,192.168.42.25,User
192.168.252.190,Buffer overflow in the index menu code (menu_pad_string of menu.c) for Mutt 1.4.1 and earlier allows remote attackers to cause a denial of service (crash) and possibly execute arbitrary code via certain mail messages.,CVE-2004-0078,0.0866,192.168.42.25,User
192.168.252.190,Solaris rpcbind can be exploited to overwrite arbitrary files and gain root access.,CVE-1999-0190,0.00044,192.168.42.25,Root
192.168.252.190,"Hybrid Network cable modems do not include an authentication mechanism for administration, allowing remote attackers to compromise the system through the HSMP protocol.",CVE-1999-0791,0.03638,192.168.42.25,User
192.168.252.190,PASV core dump in wu-ftpd daemon when attacker uses a QUOTE PASV command after specifying a username and password.,CVE-1999-0075,0.01598,192.168.42.25,User
192.168.252.190,Buffer overflow in INN 2.2.1 and earlier allows remote attackers to cause a denial of service via a maliciously formatted article.,CVE-2000-0360,0.00649,192.168.42.25,User
192.168.252.190,xpdf PDF viewer client earlier than 0.91 allows local users to overwrite arbitrary files via a symlink attack.,CVE-2000-0728,0.00042,192.168.42.25,User
192.168.252.190,IP fragment assembly in OpenBSD 2.4 allows a remote attacker to cause a denial of service by sending a large number of fragmented packets.,CVE-2000-0310,0.00325,192.168.85.204,User
192.168.252.190,"The COM_CHANGE_USER command in MySQL 3.x before 3.23.54, and 4.x to 4.0.6, allows remote attackers to execute arbitrary code via a long response.",CVE-2002-1375,0.12852,192.168.85.204,User
192.168.252.190,"Samba Web Administration Tool (SWAT) in Samba 2.0.7 installs the cgi.log logging file with world readable permissions, which allows local users to read sensitive information such as user names and passwords.",CVE-2000-0936,0.00042,192.168.85.204,User
192.168.252.190,Buffer overflow in the HTML parser for Netscape 4.75 and earlier allows remote attackers to execute arbitrary commands via a long password value in a form field.,CVE-2000-1187,0.00936,192.168.85.204,User
192.168.252.190,The jj CGI program allows command execution via shell metacharacters.,CVE-1999-0260,0.00412,192.168.85.204,User
192.168.252.190,Falcon web server 2.0.0.1020 and earlier allows remote attackers to bypass authentication and read restricted files via an extra / (slash) in the requested URL.,CVE-2002-0275,0.00319,192.168.65.228,User
192.168.252.190,"Directory traversal vulnerability in IBM Tivoli WebSEAL Policy Director 3.01 through 3.7.1 allows remote attackers to read arbitrary files or directories via encoded .. (dot dot) sequences containing ""%2e"" strings.",CVE-2001-0982,0.00615,192.168.65.228,User
192.168.252.190,Vulnerability in BSD Telnet client with encryption and Kerberos 4 authentication allows remote attackers to decrypt the session via sniffing.,CVE-1999-1098,0.00445,192.168.65.228,User
192.168.252.190,UnixWare uidadmin allows local users to modify arbitrary files via a symlink attack.,CVE-1999-0836,0.0016,192.168.65.228,User
192.168.252.190,"htsearch CGI program in htdig (ht://Dig) 3.1.5 and earlier allows remote attackers to use the -c option to specify an alternate configuration file, which could be used to (1) cause a denial of service (CPU consumption) by specifying a large file such as /dev/zero, or (2) read arbitrary files by uploading an alternate configuration file that specifies the target file.",CVE-2001-0834,0.01563,192.168.65.228,User
192.168.252.190,ftpdownload in Computer Associates InoculateIT 6.0 allows a local attacker to overwrite arbitrary files via a symlink attack on /tmp/ftpdownload.log .,CVE-2001-0625,0.00042,192.168.65.228,User
192.168.252.190,"Buffer overflow in AOLserver 3.0 allows remote attackers to cause a denial of service, and possibly execute arbitrary code, via an HTTP request with a long Authorization header.",CVE-2001-1067,0.02158,192.168.65.228,User
192.168.252.190,"The Vicam USB driver in Linux before 2.4.25 does not use the copy_from_user function when copying data from userspace to kernel space, which crosses security boundaries and allows local users to cause a denial of service.",CVE-2004-0075,0.0006,192.168.65.228,User
192.168.252.190,NTMail 5.x allows network users to bypass the NTMail proxy restrictions by redirecting their requests to NTMail's web configuration server.,CVE-2000-0416,0.01096,192.168.117.11,User
192.168.252.190,A buffer overflow in the SGI X server allows local users to gain root access through the X server font path.,CVE-1999-0413,0.00042,192.168.117.11,Root
192.168.252.190,"Cross-site scripting vulnerability in the SQLXML component of Microsoft SQL Server 2000 allows an attacker to execute arbitrary script via the root parameter as part of an XML SQL query, aka ""Script Injection via XML Tag.""",CVE-2002-0187,0.00612,192.168.117.11,Root
192.168.252.190,"Common Unix Printing System (CUPS) 1.1.14 through 1.1.17 does not properly check the return values of various file and socket operations, which could allow a remote attacker to cause a denial of service (resource exhaustion) by causing file descriptors to be assigned and not released, as demonstrated by fanta.",CVE-2002-1372,0.01398,192.168.117.11,User
192.168.252.190,ftpdownload in Computer Associates InoculateIT 6.0 allows a local attacker to overwrite arbitrary files via a symlink attack on /tmp/ftpdownload.log .,CVE-2001-0625,0.00042,192.168.117.11,User
192.168.252.190,UnixWare uidadmin allows local users to modify arbitrary files via a symlink attack.,CVE-1999-0836,0.0016,192.168.117.11,User
192.168.20.218,IIS 4.0 with URL redirection enabled allows remote attackers to cause a denial of service (crash) via a malformed request that specifies a length that is different than the actual length.,CVE-2001-0545,0.81318,192.168.252.190,User
192.168.20.218,Vulnerability in (1) Microsoft Excel 2002 and earlier and (2) Microsoft PowerPoint 2002 and earlier allows attackers to bypass macro restrictions and execute arbitrary commands by modifying the data stream in the document.,CVE-2001-0718,0.00644,192.168.252.190,User
192.168.20.218,Utah-glx in Mesa before 3.3-14 on Mandrake Linux 7.2 allows local users to overwrite arbitrary files via a symlink attack on the /tmp/glxmemory file.,CVE-2001-0474,0.00042,192.168.252.190,User
192.168.20.218,"Cross-site scripting (XSS) vulnerability in Null HTTP Server 0.5.0 and earlier allows remote attackers to insert arbitrary HTML into a ""404 Not Found"" response.",CVE-2002-1497,0.00221,192.168.252.190,User
192.168.20.218,"Insecure file permissions for Netscape FastTrack Server 2.x, Enterprise Server 2.0, and Proxy Server 2.5 in SCO UnixWare 7.0.x and 2.1.3 allow an attacker to gain root privileges.",CVE-2000-0308,0.00192,192.168.252.190,Root
192.168.20.218,IRC Xchat client versions 1.4.2 and earlier allows remote attackers to execute arbitrary commands by encoding shell metacharacters into a URL which XChat uses to launch a web browser.,CVE-2000-0787,0.10989,192.168.252.190,User
192.168.20.218,"The default configuration of mod_perl for Apache as installed on Mandrake Linux 6.1 through 7.1 sets the /perl/ directory to be browseable, which allows remote attackers to list the contents of that directory.",CVE-2000-0883,0.00795,192.168.252.190,User
192.168.44.7,"The SPP_VerifyPVV function in nCipher payShield SPP library 1.3.12, 1.5.18 and 1.6.18 returns a Status_OK value even if the HSM returns a different status code, which could cause applications to make incorrect security-critical decisions, e.g. by accepting an invalid PIN number.",CVE-2004-0063,0.00486,192.168.117.11,User
192.168.44.7,Vulnerability in LAT/Telnet Gateway (lattelnet) on Ultrix 4.1 and 4.2 allows attackers to gain root privileges.,CVE-1999-1032,0.009,192.168.117.11,Root
192.168.44.7,"Linux kernel, and possibly other operating systems, allows remote attackers to read portions of memory via a series of fragmented ICMP packets that generate an ICMP TTL Exceeded response, which includes portions of the memory in the response packet.",CVE-2002-0046,0.00513,192.168.117.11,User
192.168.44.7,Buffer overflow and denial of service in Sendmail 8.7.5 and earlier through GECOS field gives root access to local users.,CVE-1999-0131,0.00042,192.168.117.11,Root
192.168.44.7,Directory traversal vulnerability in SpoonFTP 1.1 allows local and sometimes remote attackers to access files outside of the FTP root via a ... (modified dot dot) in the CD (CWD) command.,CVE-2001-0963,0.01311,192.168.117.11,Root
192.168.44.7,"IIS 4.0 and 5.0 allows remote attackers to read documents outside of the web root, and possibly execute arbitrary commands, via malformed URLs that contain UNICODE encoded characters, aka the ""Web Server Folder Traversal"" vulnerability.",CVE-2000-0884,0.93793,192.168.117.11,Root
192.168.44.7,"A cross-site scripting vulnerability in Caucho Technology Resin before 1.2.4 allows a malicious webmaster to embed Javascript in a hyperlink that ends in a .jsp extension, which causes an error message that does not properly quote the Javascript.",CVE-2001-0828,0.00991,192.168.117.11,User
192.168.44.7,"ipfw and ip6fw in FreeBSD 4.2 and earlier allows remote attackers to bypass access restrictions by setting the ECE flag in a TCP packet, which makes the packet appear to be part of an established connection.",CVE-2001-0183,0.02657,192.168.117.11,User
192.168.44.7,"Squid 2.4 STABLE3 and earlier does not properly disable HTCP, even when ""htcp_port 0"" is specified in squid.conf, which could allow remote attackers to bypass intended access restrictions.",CVE-2002-0067,0.00695,192.168.20.218,User
