source,service,cve,exploit_prob,target,privilege
192.168.94.211,Buffer overflow in the ISAPI DLL filter for Macromedia JRun 3.1 allows remote attackers to execute arbitrary code via a direct request to the filter with a long HTTP host header field in a URL for a .jsp file.,CVE-2002-0801,0.17401,192.168.42.25,User
192.168.94.211,The Nbase-Xyplex EdgeBlaster router allows remote attackers to cause a denial of service via a scan for the FormMail CGI program.,CVE-2000-0255,0.00268,192.168.42.25,User
192.168.94.211,Directory traversal vulnerability in fsp before 2.81.b18 allows remote users to access files outside the FSP root directory.,CVE-2003-1022,0.01596,192.168.42.25,Root
192.168.94.211,"Double-free vulnerability in CVS 1.11.4 and earlier allows remote attackers to cause a denial of service and possibly execute arbitrary code via a malformed Directory request, as demonstrated by bypassing write checks to execute Update-prog and Checkin-prog commands.",CVE-2003-0015,0.29554,192.168.42.25,User
192.168.94.211,vold in Solaris 2.x allows local users to gain root access.,CVE-1999-0134,0.00044,192.168.42.25,Root
192.168.94.211,"Directory traversal vulnerability in story.pl in Interactive Story 1.3 allows a remote attacker to read arbitrary files via a .. (dot dot) attack on the ""next"" parameter.",CVE-2001-0804,0.01103,192.168.42.25,User
192.168.94.211,"Red-M 1050 (Bluetooth Access Point) uses case insensitive passwords, which makes it easier for attackers to conduct a brute force guessing attack due to the smaller space of possible passwords.",CVE-2002-0394,0.00182,192.168.42.25,User
192.168.94.211,"BisonFTP V4R1 allows local users to access directories outside of their home directory by uploading .bdl files, which can then be linked to other directories.",CVE-2001-0765,0.00042,192.168.150.103,User
192.168.94.211,"vim (aka gvim) allows local users to modify files being edited by other users via a symlink attack on the backup and swap files, when the victim is editing the file in a world writable directory.",CVE-2001-0409,0.00042,192.168.150.103,User
192.168.94.211,"Buffer overflow in AOLserver 3.0 allows remote attackers to cause a denial of service, and possibly execute arbitrary code, via an HTTP request with a long Authorization header.",CVE-2001-1067,0.02158,192.168.150.103,User
192.168.94.211,The open() function in FreeBSD allows local attackers to write to arbitrary files.,CVE-1999-0322,0.0006,192.168.150.103,User
192.168.94.211,"GNU libtool before 1.5.2, during compile time, allows local users to overwrite arbitrary files via a symlink attack on libtool directories in /tmp.",CVE-2004-0256,0.00042,192.168.150.103,User
192.168.94.211,"JRun 3.0 through 4.0 allows remote attackers to read JSP source code via an encoded null byte in an HTTP GET request, which causes the server to send the .JSP file unparsed.",CVE-2002-1025,0.00674,192.168.150.103,User
192.168.94.211,The DocumentTemplate package in Zope 2.2 and earlier allows a remote attacker to modify DTMLDocuments or DTMLMethods without authorization.,CVE-2000-0483,0.01598,192.168.150.103,User
192.168.94.211,"crontab in Vixie cron 3.0.1 and earlier does not properly drop privileges after the failed parsing of a modification operation, which could allow a local attacker to gain additional privileges when an editor is called to correct the error.",CVE-2001-0559,0.00042,192.168.117.11,User
192.168.94.211,"An X server's access control is disabled (e.g. through an ""xhost +"" command) and allows anyone to connect to the server.",CVE-1999-0526,0.80735,192.168.117.11,User
192.168.94.211,getcwd() file descriptor leak in FTP.,CVE-1999-0083,0.00622,192.168.117.11,User
192.168.94.211,"Sdbsearch.cgi in SuSE Linux 6.0-7.2 could allow remote attackers to execute arbitrary commands by uploading a keylist.txt file that contains filenames with shell metacharacters, then causing the file to be searched using a .. in the HTTP referer (from the HTTP_REFERER variable) to point to the directory that contains the keylist.txt file.",CVE-2001-1130,0.04694,192.168.117.11,User
192.168.94.211,"securetar, as used in AMaViS shell script 0.2.1 and earlier, allows users to cause a denial of service (CPU consumption) via a malformed TAR file, possibly via an incorrect file size parameter.",CVE-2002-1109,0.00052,192.168.252.190,User
192.168.94.211,Race condition in xterm allows local users to modify arbitrary files via the logging option.,CVE-1999-0965,0.00042,192.168.252.190,User
192.168.94.211,Buffer overflow in Multiple UNC Provider (MUP) in Microsoft Windows operating systems allows local users to cause a denial of service or possibly gain SYSTEM privileges via a long UNC request.,CVE-2002-0151,0.00104,192.168.252.190,User
192.168.94.211,shadow package in SuSE 8.0 allows local users to destroy the /etc/passwd and /etc/shadow files or assign extra group privileges to some users by changing filesize limits before calling programs that modify the files.,CVE-2002-0762,0.00042,192.168.252.190,User
192.168.94.211,"The COM_CHANGE_USER command in MySQL 3.x before 3.23.54, and 4.x to 4.0.6, allows remote attackers to execute arbitrary code via a long response.",CVE-2002-1375,0.12852,192.168.252.190,User
192.168.117.11,Double-free vulnerability in mysqld for MySQL before 3.23.55 allows attackers with MySQL access to cause a denial of service (crash) via mysql_change_user.,CVE-2003-0073,0.01552,192.168.252.190,User
192.168.117.11,Cross-site scripting vulnerability in the mini-browser for Winamp 2.78 and 2.79 allows remote attackers to execute script via an ID3v1 or ID3v2 tag in an MP3 file.,CVE-2002-0546,0.01056,192.168.252.190,User
192.168.117.11,"Format string vulnerability in hsftp 1.11 allows remote authenticated users to cause a denial of service and possibly execute arbitrary code via file names containing format string characters that are not properly handled when executing an ""ls"" command.",CVE-2004-0159,0.07149,192.168.252.190,User
192.168.117.11,"Format string vulnerability in stunnel before 3.22 when used in client mode for (1) smtp, (2) pop, or (3) nntp allows remote malicious servers to execute arbitrary code.",CVE-2002-0002,0.01079,192.168.252.190,User
192.168.117.11,SmallHTTP 1.204 through 3.00 beta 8 allows remote attackers to cause a denial of service via multiple long URL requests.,CVE-2001-1251,0.0112,192.168.252.190,User
192.168.117.11,Buffer overflow in NCSA HTTP daemon v1.3 allows remote command execution.,CVE-1999-0267,0.00599,192.168.252.190,User
192.168.117.11,"The UCX POP server in HP TCP/IP services for OpenVMS 4.2 through 5.3 allows local users to truncate arbitrary files via the -logfile command line option, which overrides file system permissions because the server runs with the SYSPRV and BYPASS privileges.",CVE-2002-1513,0.00042,192.168.252.190,User
192.168.117.11,"slapd in OpenLDAP 1.x before 1.2.12, and 2.x before 2.0.8, allows remote attackers to cause a denial of service (crash) via an invalid Basic Encoding Rules (BER) length field.",CVE-2001-0977,0.02417,192.168.252.190,User
192.168.117.11,"rpcbind in SGI IRIX, when using the -w command line switch, allows local users to overwrite arbitrary files via a symlink attack.",CVE-2002-1516,0.00042,192.168.20.218,User
192.168.117.11,"Internet Explorer 5.01 and earlier allows a remote attacker to create a reference to a client window and use a server-side redirect to access local files via that window, aka ""Server-side Page Reference Redirect.""",CVE-1999-0981,0.00806,192.168.20.218,User
192.168.117.11,"gnuserv before 3.12, as shipped with XEmacs, does not properly check the specified length of an X Windows MIT-MAGIC-COOKIE cookie, which allows remote attackers to execute arbitrary commands via a buffer overflow, or brute force authentication by using a short cookie length.",CVE-2001-0191,0.00597,192.168.20.218,User
192.168.117.11,Performance Metrics Collector Daemon (PMCD) in Performance Copilot in IRIX 6.x allows remote attackers to cause a denial of service (resource exhaustion) via an extremely long string to the PMCD port.,CVE-2000-1193,0.02874,192.168.20.218,User
192.168.117.11,Buffer overflow in the ISAPI DLL filter for Macromedia JRun 3.1 allows remote attackers to execute arbitrary code via a direct request to the filter with a long HTTP host header field in a URL for a .jsp file.,CVE-2002-0801,0.17401,192.168.20.218,User
192.168.117.11,Directory traversal vulnerability in SpoonFTP 1.1 allows local and sometimes remote attackers to access files outside of the FTP root via a ... (modified dot dot) in the CD (CWD) command.,CVE-2001-0963,0.01311,192.168.167.78,Root
192.168.117.11,xpdf PDF viewer client earlier than 0.91 allows local users to overwrite arbitrary files via a symlink attack.,CVE-2000-0728,0.00042,192.168.167.78,User
192.168.117.11,Buffer overflow in xlockmore xlock program version 4.16 and earlier allows local users to read sensitive data from memory via a long -mode option.,CVE-2000-0455,0.00042,192.168.167.78,User
192.168.117.11,"Unknown vulnerability in autofs on AIX 4.3.0, when using executable maps, allows attackers to execute arbitrary commands as root, possibly related to ""string handling around how the executable map is called.""",CVE-2002-1548,0.00044,192.168.167.78,Root
192.168.117.11,Buffer overflow in Novell GroupWise 6.0.1 Support Pack 1 allows remote attackers to execute arbitrary code via a long RCPT TO command.,CVE-2002-1088,0.05255,192.168.167.78,User
192.168.117.11,MajorCool mj_key_cache program allows local users to modify files via a symlink attack.,CVE-1999-0957,0.0006,192.168.167.78,User
192.168.150.103,"Cisco switches and routers running IOS 12.1 and earlier produce predictable TCP Initial Sequence Numbers (ISNs), which allows remote attackers to spoof or hijack TCP connections.",CVE-2001-0288,0.00235,192.168.94.211,User
192.168.150.103,Directory traversal vulnerability in McAfee ASaP VirusScan agent 1.0 allows remote attackers to read arbitrary files via a .. (dot dot) in the HTTP request.,CVE-2001-1144,0.01439,192.168.94.211,User
192.168.150.103,Vulnerability in HP Series 800 S/X/V Class servers allows remote attackers to gain access to the S/X/V Class console via the Service Support Processor (SSP) Teststation.,CVE-1999-1163,0.01036,192.168.94.211,User
192.168.150.103,"Identix BioLogon 2.03 and earlier does not lock secondary displays on a multi-monitor system running Windows 98 or ME, which allows an attacker with physical access to the system to bypass authentication through a secondary display.",CVE-2001-1116,0.00148,192.168.94.211,User
192.168.150.103,"Heap-based buffer overflow in Fetchmail 6.1.3 and earlier does not account for the ""@"" character when determining buffer lengths for local addresses, which allows remote attackers to execute arbitrary code via a header with a large number of local addresses.",CVE-2002-1365,0.30545,192.168.44.7,User
192.168.150.103,"rpcbind in SGI IRIX, when using the -w command line switch, allows local users to overwrite arbitrary files via a symlink attack.",CVE-2002-1516,0.00042,192.168.44.7,User
192.168.150.103,"Recourse ManTrap 1.6 sets up a chroot environment to hide the fact that it is running, but the inode number for the resulting ""/"" file system is higher than normal, which allows attackers to determine that they are in a chroot environment.",CVE-2000-1144,0.00074,192.168.44.7,Root
192.168.150.103,Buffer overflow in the Window.External function in the JScript Scripting Engine in Internet Explorer 4.01 SP1 and earlier allows remote attackers to execute arbitrary commands via a malicious web page.,CVE-1999-1093,0.00282,192.168.44.7,User
192.168.150.103,ftpdownload in Computer Associates InoculateIT 6.0 allows a local attacker to overwrite arbitrary files via a symlink attack on /tmp/ftpdownload.log .,CVE-2001-0625,0.00042,192.168.44.7,User
192.168.150.103,The file upload capability in PHP versions 3 and 4 allows remote attackers to read arbitrary files by setting hidden form fields whose names match the names of internal PHP script variables.,CVE-2000-0860,0.00834,192.168.44.7,User
192.168.150.103,Recourse ManTrap 1.6 allows attackers to cause a denial of service via a sequence of commands that navigate into and out of the /proc/self directory and executing various commands such as ls or pwd.,CVE-2000-1146,0.00059,192.168.44.7,User
192.168.150.103,libnss-pgsql in nss-pgsql 0.9.0 and earlier allows remote attackers to execute arbitrary SQL queries by inserting SQL code into an HTTP request.,CVE-2001-1089,0.00696,192.168.42.25,User
192.168.150.103,"Buffer overflow in the RPC Locator service for Microsoft Windows NT 4.0, Windows NT 4.0 Terminal Server Edition, Windows 2000, and Windows XP allows local users to execute arbitrary code via an RPC call to the service containing certain parameter information.",CVE-2003-0003,0.0209,192.168.42.25,User
192.168.150.103,"mopd (Maintenance Operations Protocol loader daemon) does not properly cleanse user-injected format strings, which allows remote attackers to execute arbitrary commands.",CVE-2000-0751,0.09154,192.168.42.25,User
192.168.150.103,"Oracle 9i Application Server 1.0.2 allows remote attackers to obtain the physical path of a file under the server root via a request for a non-existent .JSP file, which leaks the pathname in an error message.",CVE-2001-1372,0.10945,192.168.42.25,Root
192.168.150.103,"GNU libtool before 1.5.2, during compile time, allows local users to overwrite arbitrary files via a symlink attack on libtool directories in /tmp.",CVE-2004-0256,0.00042,192.168.42.25,User
192.168.150.103,"crontab in Vixie cron 3.0.1 and earlier does not properly drop privileges after the failed parsing of a modification operation, which could allow a local attacker to gain additional privileges when an editor is called to correct the error.",CVE-2001-0559,0.00042,192.168.42.25,User
192.168.150.103,"Insecure file permissions for Netscape FastTrack Server 2.x, Enterprise Server 2.0, and Proxy Server 2.5 in SCO UnixWare 7.0.x and 2.1.3 allow an attacker to gain root privileges.",CVE-2000-0308,0.00192,192.168.42.25,Root
192.168.150.103,"Vulnerability in inetd server in HP-UX 11.04 and earlier allows attackers to cause a denial of service when the ""swait"" state is used by a server.",CVE-2001-0106,0.0012,192.168.42.25,User
192.168.150.103,"The default configuration of Big Brother 1.4h2 and earlier does not include proper access restrictions, which allows remote attackers to execute arbitrary commands by using bbd to upload a file whose extension will cause it to be executed as a CGI script by the web server.",CVE-2000-0639,0.01002,192.168.65.228,User
192.168.150.103,ucbmail allows remote attackers to execute commands via shell metacharacters that are passed to it from INN.,CVE-1999-0868,0.00584,192.168.65.228,User
192.168.150.103,The AIX FTP client can be forced to execute commands from a malicious server through shell metacharacters (e.g. a pipe character).,CVE-1999-0097,0.06011,192.168.65.228,User
192.168.150.103,"crontab by Paul Vixie uses predictable file names for a temporary file and does not properly ensure that the file is owned by the user executing the crontab -e command, which allows local users with write access to the crontab spool directory to execute arbitrary commands by creating world-writeable temporary files and modifying them while the victim is editing the file.",CVE-2000-1096,0.00042,192.168.65.228,User
192.168.150.103,"Common Unix Printing System (CUPS) 1.1.14 through 1.1.17 does not properly check the return values of various file and socket operations, which could allow a remote attacker to cause a denial of service (resource exhaustion) by causing file descriptors to be assigned and not released, as demonstrated by fanta.",CVE-2002-1372,0.01398,192.168.65.228,User
192.168.65.228,The Web interface to Cisco 600 routers running CBOS 2.4.1 and earlier allow remote attackers to cause a denial of service via a URL that does not end in a space character.,CVE-2001-0058,0.00867,192.168.85.204,User
192.168.65.228,getcwd() file descriptor leak in FTP.,CVE-1999-0083,0.00622,192.168.85.204,User
192.168.65.228,"Insecure file permissions for Netscape FastTrack Server 2.x, Enterprise Server 2.0, and Proxy Server 2.5 in SCO UnixWare 7.0.x and 2.1.3 allow an attacker to gain root privileges.",CVE-2000-0308,0.00192,192.168.85.204,Root
192.168.65.228,"Squid 2.4 STABLE3 and earlier does not properly disable HTCP, even when ""htcp_port 0"" is specified in squid.conf, which could allow remote attackers to bypass intended access restrictions.",CVE-2002-0067,0.00695,192.168.85.204,User
192.168.65.228,"Netscape Communicator before version 4.73 and Navigator 4.07 do not properly validate SSL certificates, which allows remote attackers to steal information by redirecting traffic from a legitimate web server to their own malicious server, aka the ""Acros-Suencksen SSL"" vulnerability.",CVE-2000-0406,0.00594,192.168.117.11,User
192.168.65.228,Directory traversal vulnerability in fsp before 2.81.b18 allows remote users to access files outside the FSP root directory.,CVE-2003-1022,0.01596,192.168.117.11,Root
192.168.65.228,Blahz-DNS 0.2 and earlier allows remote attackers to bypass authentication and modify configuration by directly requesting CGI programs such as dostuff.php instead of going through the login screen.,CVE-2002-0599,0.30131,192.168.117.11,User
192.168.65.228,"The SPP_VerifyPVV function in nCipher payShield SPP library 1.3.12, 1.5.18 and 1.6.18 returns a Status_OK value even if the HSM returns a different status code, which could cause applications to make incorrect security-critical decisions, e.g. by accepting an invalid PIN number.",CVE-2004-0063,0.00486,192.168.117.11,User
192.168.65.228,Directory traversal vulnerability in Extent RBS ISP web server allows remote attackers to read sensitive information via a .. (dot dot) attack on the Image parameter.,CVE-2000-1036,0.01215,192.168.252.190,User
192.168.65.228,bb-hostsvc.sh in Big Brother 1.4h1 and earlier allows remote attackers to read arbitrary files via a .. (dot dot) attack on the HOSTSVC parameter.,CVE-2000-0638,0.05376,192.168.252.190,User
192.168.65.228,"Denial of service in BIND named via consuming more than ""fdmax"" file descriptors.",CVE-1999-0848,0.0033,192.168.252.190,User
192.168.65.228,Off-by-one error in the channel code of OpenSSH 2.0 through 3.0.2 allows local users or remote malicious servers to gain privileges.,CVE-2002-0083,0.00871,192.168.252.190,User
192.168.65.228,Kerberos 4 allows remote attackers to obtain sensitive information via a malformed UDP packet that generates an error string that inadvertently includes the realm name and the last user.,CVE-1999-1099,0.00564,192.168.252.190,User
192.168.65.228,"The HTTP administration interface for HP Procurve 4000M Switch firmware before C.09.16, with stacking features and remote administration enabled, does not authenticate requests to reset the device, which allows remote attackers to cause a denial of service via a direct request to the device_reset CGI program.",CVE-2002-1147,0.06929,192.168.167.78,User
192.168.65.228,Format string vulnerability in screen 3.9.5 and earlier allows local users to gain root privileges via format characters in the vbell_msg initialization variable.,CVE-2000-0901,0.00042,192.168.167.78,Root
192.168.65.228,IIS 4.0 with URL redirection enabled allows remote attackers to cause a denial of service (crash) via a malformed request that specifies a length that is different than the actual length.,CVE-2001-0545,0.81318,192.168.167.78,User
192.168.65.228,"Cisco Virtual Private Network (VPN) Client software 2.x.x, and 3.x before 3.5.1C, does not properly verify that certificate DN fields match those of the certificate from the VPN Concentrator, which allows remote attackers to conduct man-in-the-middle attacks.",CVE-2002-1106,0.0036,192.168.167.78,User
192.168.65.228,Heap-based buffer overflow in Calife 2.8.5 and earlier may allow local users to execute arbitrary code via a long password.,CVE-2004-0188,0.00042,192.168.167.78,User
192.168.65.228,"Directory traversal vulnerability in story.pl in Interactive Story 1.3 allows a remote attacker to read arbitrary files via a .. (dot dot) attack on the ""next"" parameter.",CVE-2001-0804,0.01103,192.168.167.78,User
192.168.65.228,"Microsoft Virtual Machine (VM) up to and including build 5.0.3805 allows remote attackers to cause a denial of service (crash) in Internet Explorer via invalid handle data in a Java applet, aka ""Handle Validation Flaw.""",CVE-2002-0867,0.01115,192.168.167.78,User
192.168.65.228,libnss-pgsql in nss-pgsql 0.9.0 and earlier allows remote attackers to execute arbitrary SQL queries by inserting SQL code into an HTTP request.,CVE-2001-1089,0.00696,192.168.167.78,User
192.168.65.228,Lynx allows a local user to overwrite sensitive files through /tmp symlinks.,CVE-1999-0371,0.00042,192.168.44.7,User
192.168.65.228,"The vncserver wrapper for vnc before 3.3.3r2-21 uses the rand() function instead of srand(), which causes vncserver to generate weak cookies.",CVE-2002-1511,0.0079,192.168.44.7,User
192.168.65.228,"Cross-site scripting vulnerability in analog before 5.22 allows remote attackers to execute Javascript via an HTTP request containing the script, which is entered into a web logfile and not properly filtered by analog during display.",CVE-2002-0166,0.01854,192.168.44.7,User
192.168.65.228,Buffer overflow in VMware Authorization Service for VMware GSX Server 2.0.0 build-2050 allows remote authenticated users to execute arbitrary code via a long GLOBAL argument.,CVE-2002-0814,0.13657,192.168.44.7,User
192.168.65.228,The Nautica Marlin bridge allows remote attackers to cause a denial of service via a zero length UDP packet to the SNMP port.,CVE-2000-0221,0.00849,192.168.44.7,User
192.168.65.228,"Heap corruption vulnerability in the ""at"" program allows local users to execute arbitrary code via a malformed execution time, which causes at to free the same memory twice.",CVE-2002-0004,0.00042,192.168.42.25,User
192.168.65.228,Pegasus Mail 3.12 allows remote attackers to read arbitrary files via an embedded URL that calls the mailto: protocol with a -F switch.,CVE-2000-0930,0.02003,192.168.42.25,User
192.168.65.228,"FrontPage Server Extensions (FPSE) in IIS 4.0 and 5.0 allows remote attackers to cause a denial of service via a malformed form, aka the ""Malformed Web Form Submission"" vulnerability.",CVE-2001-0096,0.04326,192.168.42.25,User
192.168.65.228,Denial of service in IIS using long URLs.,CVE-1999-0281,0.00304,192.168.42.25,User
192.168.65.228,"When the Ntconfig.pol file is used on a server whose name is longer than 13 characters, Windows NT does not properly enforce policies for global groups, which could allow users to bypass restrictions that were intended by those policies.",CVE-1999-1359,0.00297,192.168.42.25,User
192.168.85.204,Buffer overflow in CrackLib 2.5 may allow local users to gain root privileges via a long GECOS field.,CVE-1999-1140,0.00043,192.168.117.11,Root
192.168.85.204,IRC Xchat client versions 1.4.2 and earlier allows remote attackers to execute arbitrary commands by encoding shell metacharacters into a URL which XChat uses to launch a web browser.,CVE-2000-0787,0.10989,192.168.117.11,User
192.168.85.204,"The COM_CHANGE_USER command in MySQL 3.x before 3.23.54, and 4.x to 4.0.6, allows remote attackers to execute arbitrary code via a long response.",CVE-2002-1375,0.12852,192.168.117.11,User
192.168.85.204,webmin 0.84 and earlier allows local users to overwrite and create arbitrary files via a symlink attack.,CVE-2001-0222,0.00042,192.168.117.11,User
192.168.85.204,"Listening TCP ports are sequentially allocated, allowing spoofing attacks.",CVE-1999-0074,0.00244,192.168.117.11,User
192.168.85.204,xpdf PDF viewer client earlier than 0.91 allows local users to overwrite arbitrary files via a symlink attack.,CVE-2000-0728,0.00042,192.168.252.190,User
192.168.85.204,"IRIX soundplayer program allows local users to gain privileges by including shell metacharacters in a .wav file, which is executed via the midikeys program.",CVE-2000-0013,0.00042,192.168.252.190,User
192.168.85.204,"FrontPage Server Extensions (FPSE) in IIS 4.0 and 5.0 allows remote attackers to cause a denial of service via a malformed form, aka the ""Malformed Web Form Submission"" vulnerability.",CVE-2001-0096,0.04326,192.168.252.190,User
192.168.85.204,authenticate.cgi CGI program in Aplio PRO allows remote attackers to execute arbitrary commands via shell metacharacters in the password parameter.,CVE-2000-0923,0.09243,192.168.252.190,User
192.168.85.204,Vulnerability in the cache-limiting function of the unified name service daemon (nsd) in IRIX 6.5.4 through 6.5.11 allows remote attackers to cause a denial of service by forcing the cache to fill the disk.,CVE-2002-0038,0.01301,192.168.252.190,User
192.168.85.204,SmallHTTP 1.204 through 3.00 beta 8 allows remote attackers to cause a denial of service via multiple long URL requests.,CVE-2001-1251,0.0112,192.168.252.190,User
192.168.85.204,"gnuserv before 3.12, as shipped with XEmacs, does not properly check the specified length of an X Windows MIT-MAGIC-COOKIE cookie, which allows remote attackers to execute arbitrary commands via a buffer overflow, or brute force authentication by using a short cookie length.",CVE-2001-0191,0.00597,192.168.44.7,User
192.168.85.204,Vulnerability in passwd in SCO UNIX 4.0 and earlier allows attackers to cause a denial of service by preventing users from being able to log into the system.,CVE-1999-1162,0.00143,192.168.44.7,User
192.168.85.204,Omnicron Technologies OmniHTTPD Professional 2.08 and earlier allows a remote attacker to create a denial of service via a long POST URL request.,CVE-2001-0613,0.00758,192.168.44.7,User
