source,service,cve,exploit_prob,target,privilege
192.168.44.7,"vim (aka gvim) allows local users to modify files being edited by other users via a symlink attack on the backup and swap files, when the victim is editing the file in a world writable directory.",CVE-2001-0409,0.00042,192.168.20.218,User
192.168.44.7,Buffer overflow in SysVInit in Red Hat Linux 5.1 and earlier allows local users to gain privileges.,CVE-1999-1329,0.00045,192.168.20.218,User
192.168.44.7,"Microsoft Internet Explorer 5.01 and 6.0 allow remote attackers to execute arbitrary code via malformed Content-Disposition and Content-Type header fields that cause the application for the spoofed file type to pass the file back to the operating system for handling rather than raise an error message, aka the second variant of the ""Content Disposition"" vulnerability.",CVE-2002-0188,0.03934,192.168.20.218,User
192.168.44.7,"FTP proxy in Squid before 2.4.STABLE6 does not compare the IP addresses of control and data connections with the FTP server, which allows remote attackers to bypass firewall rules or spoof FTP server responses.",CVE-2002-0714,0.00673,192.168.20.218,User
192.168.44.7,Buffer overflow in dlvr_audit for Caldera OpenServer 5.0.5 and 5.0.6 allows local users to gain root privileges.,CVE-2002-0442,0.00042,192.168.20.218,Root
192.168.44.7,"JRun 3.0 through 4.0 allows remote attackers to read JSP source code via an encoded null byte in an HTTP GET request, which causes the server to send the .JSP file unparsed.",CVE-2002-1025,0.00674,192.168.20.218,User
192.168.44.7,"sendmessage.cgi in W3Mail 1.0.2, and possibly other CGI programs, allows remote attackers to execute arbitrary commands via shell metacharacters in any field of the 'Compose Message' page.",CVE-2001-1100,0.01582,192.168.20.218,User
