source,service,cve,exploit_prob,target,privilege
192.168.149.52,The view_page.html sample page in the MiniVend shopping cart program allows remote attackers to execute arbitrary commands via shell metacharacters.,CVE-2000-0635,0.00597,192.168.73.113,User
192.168.149.52,The Microsoft Outlook mail client identifies the physical path of the sender's machine within a winmail.dat attachment to Rich Text Format (RTF) files.,CVE-2000-0753,0.00505,192.168.73.113,User
192.168.149.52,"The LAN-to-LAN IPSEC capability for Cisco VPN 3000 Concentrator 2.2.x, and 3.x before 3.5.4, allows remote attackers to cause a denial of service via an incoming LAN-to-LAN connection with an existing security association with another device on the remote network, which causes the concentrator to remove the previous connection.",CVE-2002-1102,0.00823,192.168.73.113,User
192.168.149.52,Heap-based buffer overflow in Calife 2.8.5 and earlier may allow local users to execute arbitrary code via a long password.,CVE-2004-0188,0.00042,192.168.73.113,User
192.168.149.52,"Common Unix Printing System (CUPS) 1.1.14 through 1.1.17 does not properly check the return values of various file and socket operations, which could allow a remote attacker to cause a denial of service (resource exhaustion) by causing file descriptors to be assigned and not released, as demonstrated by fanta.",CVE-2002-1372,0.01398,192.168.73.113,User
192.168.233.169,"An SSH 1.2.27 server allows a client to use the ""none"" cipher, even if it is not allowed by the server policy.",CVE-1999-1010,0.00042,192.168.242.133,User
192.168.233.169,"Expreserve, as used in vi and ex, allows local users to overwrite arbitrary files and gain root access.",CVE-1999-0132,0.00065,192.168.242.133,Root
192.168.233.169,NTMail 5.x allows network users to bypass the NTMail proxy restrictions by redirecting their requests to NTMail's web configuration server.,CVE-2000-0416,0.01096,192.168.242.133,User
192.168.233.169,Cross-site scripting vulnerability in the mini-browser for Winamp 2.78 and 2.79 allows remote attackers to execute script via an ID3v1 or ID3v2 tag in an MP3 file.,CVE-2002-0546,0.01056,192.168.242.133,User
192.168.233.169,Race condition in xterm allows local users to modify arbitrary files via the logging option.,CVE-1999-0965,0.00042,192.168.242.133,User
192.168.233.169,Livingston portmaster machines could be rebooted via a series of commands.,CVE-1999-0218,0.03841,192.168.165.95,User
192.168.233.169,SQL injection vulnerability in the PostgreSQL auth module for courier 0.40 and earlier allows remote attackers to execute SQL code via the user name.,CVE-2003-0040,0.00258,192.168.165.95,User
192.168.233.169,"Outlook Web Access (OWA) in Microsoft Exchange 5.5 Server, when used with Internet Explorer, does not properly detect certain inline script, which can allow remote attackers to perform arbitrary actions on a user's Exchange mailbox via an HTML e-mail message.",CVE-2001-0726,0.00678,192.168.141.140,User
192.168.233.169,"In Linux before version 2.0.36, remote attackers can spoof a TCP connection and pass data to the application layer before fully establishing the connection.",CVE-1999-0414,0.00756,192.168.141.140,User
192.168.233.169,"Buffer overflow in Sendmail before 8.12.5, when configured to use a custom DNS map to query TXT records, allows remote attackers to cause a denial of service and possibly execute arbitrary code via a malicious DNS server.",CVE-2002-0906,0.058,192.168.141.140,User
192.168.233.169,"In Linux before version 2.0.36, remote attackers can spoof a TCP connection and pass data to the application layer before fully establishing the connection.",CVE-1999-0414,0.00756,192.168.149.52,User
192.168.233.169,"The password protection feature of Microsoft Money can store the password in plaintext, which allows attackers with physical access to the system to obtain the password, aka the ""Money Password"" vulnerability.",CVE-2000-0777,0.00235,192.168.149.52,User
192.168.233.169,Pegasus Mail 3.12 allows remote attackers to read arbitrary files via an embedded URL that calls the mailto: protocol with a -F switch.,CVE-2000-0930,0.02003,192.168.149.52,User
192.168.233.169,Buffer overflow in INN 2.2.1 and earlier allows remote attackers to cause a denial of service via a maliciously formatted article.,CVE-2000-0360,0.00649,192.168.149.52,User
192.168.233.169,"BisonFTP V4R1 allows local users to access directories outside of their home directory by uploading .bdl files, which can then be linked to other directories.",CVE-2001-0765,0.00042,192.168.73.113,User
192.168.233.169,Kerberos 4 allows remote attackers to obtain sensitive information via a malformed UDP packet that generates an error string that inadvertently includes the realm name and the last user.,CVE-1999-1099,0.00564,192.168.73.113,User
192.168.233.169,"The COM_CHANGE_USER command in MySQL 3.x before 3.23.54, and 4.x to 4.0.6, allows remote attackers to execute arbitrary code via a long response.",CVE-2002-1375,0.12852,192.168.73.113,User
192.168.233.169,"A cross-site scripting vulnerability in Caucho Technology Resin before 1.2.4 allows a malicious webmaster to embed Javascript in a hyperlink that ends in a .jsp extension, which causes an error message that does not properly quote the Javascript.",CVE-2001-0828,0.00991,192.168.73.113,User
192.168.73.113,"Internet Explorer 5.01 and earlier allows a remote attacker to create a reference to a client window and use a server-side redirect to access local files via that window, aka ""Server-side Page Reference Redirect.""",CVE-1999-0981,0.00806,192.168.141.140,User
192.168.73.113,"The cryptographic challenge of SMB authentication in Windows 95 and Windows 98 can be reused, allowing an attacker to replay the response and impersonate a user.",CVE-1999-0391,0.00383,192.168.141.140,User
192.168.73.113,"Cisco Virtual Private Network (VPN) Client software 2.x.x, and 3.x before 3.5.1C, does not properly verify that certificate DN fields match those of the certificate from the VPN Concentrator, which allows remote attackers to conduct man-in-the-middle attacks.",CVE-2002-1106,0.0036,192.168.233.169,User
192.168.73.113,"The UCX POP server in HP TCP/IP services for OpenVMS 4.2 through 5.3 allows local users to truncate arbitrary files via the -logfile command line option, which overrides file system permissions because the server runs with the SYSPRV and BYPASS privileges.",CVE-2002-1513,0.00042,192.168.233.169,User
192.168.73.113,Buffer overflow in mail included with SunOS 5.8 for x86 allows a local user to gain privileges via a long HOME environment variable.,CVE-2001-0686,0.00044,192.168.165.95,User
192.168.73.113,The jj CGI program allows command execution via shell metacharacters.,CVE-1999-0260,0.00412,192.168.165.95,User
192.168.73.113,Format string vulnerability in screen 3.9.5 and earlier allows local users to gain root privileges via format characters in the vbell_msg initialization variable.,CVE-2000-0901,0.00042,192.168.165.95,Root
192.168.73.113,Microsoft SQL Server 2000 allows remote attackers to cause a denial of service via a malformed 0x08 packet that is missing a colon separator.,CVE-2002-0729,0.00817,192.168.165.95,User
192.168.73.113,procfs in BSD systems allows local users to gain root privileges by modifying the /proc/pid/mem interface via a modified file descriptor for stderr.,CVE-2000-0094,0.00042,192.168.242.133,Root
192.168.73.113,"Common Unix Printing System (CUPS) 1.1.14 through 1.1.17 does not properly check the return values of various file and socket operations, which could allow a remote attacker to cause a denial of service (resource exhaustion) by causing file descriptors to be assigned and not released, as demonstrated by fanta.",CVE-2002-1372,0.01398,192.168.242.133,User
192.168.73.113,Savant web server allows remote attackers to execute arbitrary commands via a long GET request.,CVE-2000-0641,0.0544,192.168.242.133,User
192.168.73.113,"The get_real_string function in Monkey HTTP Daemon (monkeyd) 0.8.1 and earlier allows remote attackers to cause a denial of service (crash) via an HTTP request with a sequence of ""%"" characters and a missing Host field.",CVE-2004-0276,0.09187,192.168.242.133,User
192.168.73.113,"Microsoft Internet Explorer 5.01 and 6.0 allow remote attackers to execute arbitrary code via malformed Content-Disposition and Content-Type header fields that cause the application for the spoofed file type to pass the file back to the operating system for handling rather than raise an error message, aka the second variant of the ""Content Disposition"" vulnerability.",CVE-2002-0188,0.03934,192.168.242.133,User
192.168.73.113,A remote attacker can read information from a Netscape user's cache via JavaScript.,CVE-1999-0790,0.00788,192.168.149.52,User
192.168.73.113,"The campas CGI program provided with some NCSA web servers allows an attacker to execute arbitrary commands via encoded carriage return characters in the query string, as demonstrated by reading the password file.",CVE-1999-0146,0.06359,192.168.149.52,User
192.168.73.113,Buffer overflow in Microsoft Terminal Services Advanced Client (TSAC) ActiveX control allows remote attackers to execute arbitrary code via a long server name field.,CVE-2002-0726,0.05083,192.168.149.52,User
192.168.73.113,The Preloader ActiveX control used by Internet Explorer allows remote attackers to read arbitrary files.,CVE-1999-0917,0.00504,192.168.149.52,User
192.168.165.95,"PGP Corporate Desktop before 7.1, Personal Security before 7.0.3, Freeware before 7.0.3, and E-Business Server before 7.1 does not properly display when invalid userID's are used to sign a message, which could allow an attacker to make the user believe that the document has been signed by a trusted third party by adding a second, invalid user ID to a key which has already been signed by the third party, aka the ""PGPsdk Key Validity Vulnerability.""",CVE-2001-1016,0.00426,192.168.141.140,User
192.168.165.95,"Buffer overflow in the RPC Locator service for Microsoft Windows NT 4.0, Windows NT 4.0 Terminal Server Edition, Windows 2000, and Windows XP allows local users to execute arbitrary code via an RPC call to the service containing certain parameter information.",CVE-2003-0003,0.02013,192.168.141.140,User
192.168.165.95,"The default configuration of mod_perl for Apache as installed on Mandrake Linux 6.1 through 7.1 sets the /perl/ directory to be browseable, which allows remote attackers to list the contents of that directory.",CVE-2000-0883,0.00795,192.168.141.140,User
192.168.165.95,"Multiple Cisco networking products allow remote attackers to cause a denial of service on the local network via a series of ARP packets sent to the router's interface that contains a different MAC address for the router, which eventually causes the router to overwrite the MAC address in its ARP table.",CVE-2001-0895,0.02268,192.168.141.140,User
192.168.165.95,Infradig Inframail prior to 3.98a allows a remote attacker to create a denial of service via a malformed POST request which includes a space followed by a large string.,CVE-2001-0377,0.00835,192.168.141.140,User
192.168.165.95,Format string vulnerability in screen 3.9.5 and earlier allows local users to gain root privileges via format characters in the vbell_msg initialization variable.,CVE-2000-0901,0.00042,192.168.73.113,Root
192.168.165.95,Directory traversal vulnerability in cal_make.pl in PerlCal allows remote attackers to read arbitrary files via a .. (dot dot) in the p0 parameter.,CVE-2001-0463,0.00894,192.168.73.113,User
192.168.165.95,libnss-pgsql in nss-pgsql 0.9.0 and earlier allows remote attackers to execute arbitrary SQL queries by inserting SQL code into an HTTP request.,CVE-2001-1089,0.00696,192.168.73.113,User
192.168.165.95,Directory traversal vulnerability in SpoonFTP 1.1 allows local and sometimes remote attackers to access files outside of the FTP root via a ... (modified dot dot) in the CD (CWD) command.,CVE-2001-0963,0.01311,192.168.242.133,Root
192.168.165.95,"IBM WebSphere allows remote attackers to read source code for executable web files by directly calling the default InvokerServlet using a URL which contains the ""/servlet/file"" string.",CVE-2000-0652,0.00408,192.168.242.133,User
192.168.165.95,The NSAPI plugins for TGA and the Java Servlet proxy in HP-UX VVOS 10.24 and 11.04 allows an attacker to cause a denial of service (high CPU utilization).,CVE-2000-0965,0.0012,192.168.242.133,User
192.168.165.95,"Unknown vulnerability in netprint in IRIX 6.2, and possibly other versions, allows local users with lp privileges attacker to execute arbitrary commands via the -n option.",CVE-2001-0485,0.00042,192.168.242.133,User
192.168.141.140,"The vncserver wrapper for vnc before 3.3.3r2-21 uses the rand() function instead of srand(), which causes vncserver to generate weak cookies.",CVE-2002-1511,0.0079,192.168.165.95,User
192.168.141.140,"IRIX soundplayer program allows local users to gain privileges by including shell metacharacters in a .wav file, which is executed via the midikeys program.",CVE-2000-0013,0.00042,192.168.165.95,User
192.168.141.140,Recourse ManTrap 1.6 allows attackers to cause a denial of service via a sequence of commands that navigate into and out of the /proc/self directory and executing various commands such as ls or pwd.,CVE-2000-1146,0.00059,192.168.242.133,User
192.168.141.140,Directory traversal vulnerability in fsp before 2.81.b18 allows remote users to access files outside the FSP root directory.,CVE-2003-1022,0.01596,192.168.242.133,Root
192.168.141.140,Buffer overflow in nslookupComplain function in BIND 4 allows remote attackers to gain root privileges.,CVE-2001-0011,0.00887,192.168.242.133,Root
192.168.141.140,"The cryptographic challenge of SMB authentication in Windows 95 and Windows 98 can be reused, allowing an attacker to replay the response and impersonate a user.",CVE-1999-0391,0.00383,192.168.242.133,User
192.168.141.140,"Phormation PHP script 0.9.1 and earlier allows remote attackers to execute arbitrary code by including files from remote web sites, using an HTTP request that modifies the phormationdir variable.",CVE-2001-1237,0.02557,192.168.242.133,User
192.168.141.140,The Web interface to Cisco 600 routers running CBOS 2.4.1 and earlier allow remote attackers to cause a denial of service via a URL that does not end in a space character.,CVE-2001-0058,0.00867,192.168.149.52,User
192.168.141.140,The NSAPI plugins for TGA and the Java Servlet proxy in HP-UX VVOS 10.24 and 11.04 allows an attacker to cause a denial of service (high CPU utilization).,CVE-2000-0965,0.0012,192.168.149.52,User
192.168.242.133,Pegasus Mail 3.12 allows remote attackers to read arbitrary files via an embedded URL that calls the mailto: protocol with a -F switch.,CVE-2000-0930,0.02003,192.168.73.113,User
192.168.242.133,Race condition in wu-ftpd and BSDI ftpd allows remote attackers to gain root access via the SITE EXEC command.,CVE-1999-0955,0.00507,192.168.73.113,Root
192.168.242.133,"Buffer overflow in the RPC Locator service for Microsoft Windows NT 4.0, Windows NT 4.0 Terminal Server Edition, Windows 2000, and Windows XP allows local users to execute arbitrary code via an RPC call to the service containing certain parameter information.",CVE-2003-0003,0.02013,192.168.165.95,User
192.168.242.133,"htsearch CGI program in htdig (ht://Dig) 3.1.5 and earlier allows remote attackers to use the -c option to specify an alternate configuration file, which could be used to (1) cause a denial of service (CPU consumption) by specifying a large file such as /dev/zero, or (2) read arbitrary files by uploading an alternate configuration file that specifies the target file.",CVE-2001-0834,0.01563,192.168.165.95,User
192.168.242.133,Pegasus Mail 3.12 allows remote attackers to read arbitrary files via an embedded URL that calls the mailto: protocol with a -F switch.,CVE-2000-0930,0.02003,192.168.165.95,User
192.168.242.133,"mopd (Maintenance Operations Protocol loader daemon) does not properly cleanse user-injected format strings, which allows remote attackers to execute arbitrary commands.",CVE-2000-0751,0.09154,192.168.165.95,User
192.168.242.133,"SunOS 4.1.2 and earlier allows local users to gain privileges via ""LD_*"" environmental variables to certain dynamically linked setuid or setgid programs such as (1) login, (2) su, or (3) sendmail, that change the real and effective user ids to the same user.",CVE-1999-1142,0.0006,192.168.165.95,User
192.168.242.133,"SunOS 4.1.2 and earlier allows local users to gain privileges via ""LD_*"" environmental variables to certain dynamically linked setuid or setgid programs such as (1) login, (2) su, or (3) sendmail, that change the real and effective user ids to the same user.",CVE-1999-1142,0.0006,192.168.141.140,User
192.168.242.133,"Phormation PHP script 0.9.1 and earlier allows remote attackers to execute arbitrary code by including files from remote web sites, using an HTTP request that modifies the phormationdir variable.",CVE-2001-1237,0.02557,192.168.141.140,User
192.168.242.133,"ISC BIND 9 before 9.2.1 allows remote attackers to cause a denial of service (shutdown) via a malformed DNS packet that triggers an error condition that is not properly handled when the rdataset parameter to the dns_message_findtype() function in message.c is not NULL, aka DoS_findtype.",CVE-2002-0400,0.11226,192.168.141.140,User
192.168.242.133,"vim (aka gvim) allows local users to modify files being edited by other users via a symlink attack on the backup and swap files, when the victim is editing the file in a world writable directory.",CVE-2001-0409,0.00042,192.168.233.169,User
192.168.242.133,"Heap-based buffer overflow in Fetchmail 6.1.3 and earlier does not account for the ""@"" character when determining buffer lengths for local addresses, which allows remote attackers to execute arbitrary code via a header with a large number of local addresses.",CVE-2002-1365,0.30545,192.168.233.169,User
192.168.242.133,"The campas CGI program provided with some NCSA web servers allows an attacker to execute arbitrary commands via encoded carriage return characters in the query string, as demonstrated by reading the password file.",CVE-1999-0146,0.06359,192.168.233.169,User
192.168.242.133,Windows NT 4.0 SP4 and earlier allows local users to gain privileges by modifying the symbolic link table in the \?? object folder using a different case letter (upper or lower) to point to a different device.,CVE-1999-1317,0.00044,192.168.233.169,User
