source,service,cve,exploit_prob,target,privilege
192.168.136.245,"FTP proxy in Squid before 2.4.STABLE6 does not compare the IP addresses of control and data connections with the FTP server, which allows remote attackers to bypass firewall rules or spoof FTP server responses.",CVE-2002-0714,0.00673,192.168.87.232,User
192.168.136.245,Memory leak in Terminal servers in Windows NT and Windows 2000 allows remote attackers to cause a denial of service (memory exhaustion) via a large number of malformed Remote Desktop Protocol (RDP) requests to port 3389.,CVE-2001-0540,0.02583,192.168.87.232,User
192.168.136.245,"IBM Web Traffic Express Caching Proxy Server 3.6 and 4.x before 4.0.1.26 allows remote attackers to cause a denial of service (crash) via an HTTP request to helpout.exe with a missing HTTP version number, which causes ibmproxy.exe to crash.",CVE-2002-1169,0.02925,192.168.104.122,User
192.168.136.245,"JRun 3.0 through 4.0 allows remote attackers to read JSP source code via an encoded null byte in an HTTP GET request, which causes the server to send the .JSP file unparsed.",CVE-2002-1025,0.00674,192.168.104.122,User
192.168.136.245,Buffer overflow in SysVInit in Red Hat Linux 5.1 and earlier allows local users to gain privileges.,CVE-1999-1329,0.00045,192.168.104.122,User
192.168.136.245,"securetar, as used in AMaViS shell script 0.2.1 and earlier, allows users to cause a denial of service (CPU consumption) via a malformed TAR file, possibly via an incorrect file size parameter.",CVE-2002-1109,0.00052,192.168.104.122,User
192.168.136.245,PSCOErrPage.htm in Netscape PublishingXpert 2.5 before SP2 allows remote attackers to read arbitrary files by specifying the target file in the errPagePath parameter.,CVE-2000-1196,0.01991,192.168.104.122,User
192.168.136.245,"GnuPG (gpg) 1.0.3 does not properly check all signatures of a file containing multiple documents, which allows an attacker to modify contents of all documents but the first without detection.",CVE-2000-0974,0.01251,192.168.249.119,User
192.168.136.245,"Auction Weaver 1.0 through 1.04 does not properly validate the names of form fields, which allows remote attackers to delete arbitrary files and directories via a .. (dot dot) attack.",CVE-2000-0810,0.01221,192.168.249.119,User
192.168.136.245,Buffer overflow in Solaris x86 mkcookie allows local users to obtain root access.,CVE-1999-0139,0.00044,192.168.253.211,Root
192.168.136.245,Performance Metrics Collector Daemon (PMCD) in Performance Copilot in IRIX 6.x allows remote attackers to cause a denial of service (resource exhaustion) via an extremely long string to the PMCD port.,CVE-2000-1193,0.02874,192.168.253.211,User
192.168.136.245,"The campas CGI program provided with some NCSA web servers allows an attacker to execute arbitrary commands via encoded carriage return characters in the query string, as demonstrated by reading the password file.",CVE-1999-0146,0.06359,192.168.253.211,User
192.168.136.245,"Microsoft Virtual Machine (VM) up to and including build 5.0.3805 allows remote attackers to cause a denial of service (crash) in Internet Explorer via invalid handle data in a Java applet, aka ""Handle Validation Flaw.""",CVE-2002-0867,0.01115,192.168.253.211,User
192.168.136.245,The Nbase-Xyplex EdgeBlaster router allows remote attackers to cause a denial of service via a scan for the FormMail CGI program.,CVE-2000-0255,0.00268,192.168.58.129,User
192.168.136.245,Buffer overflow in xlockmore xlock program version 4.16 and earlier allows local users to read sensitive data from memory via a long -mode option.,CVE-2000-0455,0.00042,192.168.58.129,User
192.168.136.245,"Memory leak in Cisco Catalyst 4000, 5000, and 6000 series switches allows remote attackers to cause a denial of service via a series of failed telnet authentication attempts.",CVE-2001-0041,0.00755,192.168.58.129,User
192.168.136.245,"The snprintf function in the db library 1.85.4 ignores the size parameter, which could allow attackers to exploit buffer overflows that would be prevented by a properly implemented snprintf.",CVE-1999-1330,0.00059,192.168.254.147,User
192.168.136.245,Buffer overflow in Microsoft Terminal Services Advanced Client (TSAC) ActiveX control allows remote attackers to execute arbitrary code via a long server name field.,CVE-2002-0726,0.05083,192.168.254.147,User
192.168.136.245,"Squid 2.4 STABLE3 and earlier does not properly disable HTCP, even when ""htcp_port 0"" is specified in squid.conf, which could allow remote attackers to bypass intended access restrictions.",CVE-2002-0067,0.00695,192.168.6.130,User
192.168.136.245,"Heap corruption vulnerability in the ""at"" program allows local users to execute arbitrary code via a malformed execution time, which causes at to free the same memory twice.",CVE-2002-0004,0.00042,192.168.6.130,User
192.168.136.245,Buffer overflow in cb_reset in the System Service Processor (SSP) package of SunOS 5.8 allows a local user to execute arbitrary code via a long argument.,CVE-2001-0699,0.00044,192.168.78.150,User
192.168.136.245,Buffer overflow in xmcd 2.0p12 allows local users to gain access through an environmental variable.,CVE-1999-0318,0.00045,192.168.78.150,User
192.168.136.245,IBM Network Station Manager NetStation allows local users to gain privileges via a symlink attack.,CVE-2000-0027,0.00042,192.168.78.150,User
192.168.136.245,"Sendmail before 8.11.4, and 8.12.0 before 8.12.0.Beta10, allows local users to cause a denial of service and possibly corrupt the heap and gain privileges via race conditions in signal handlers.",CVE-2001-1349,0.00042,192.168.82.35,User
192.168.136.245,"The UCX POP server in HP TCP/IP services for OpenVMS 4.2 through 5.3 allows local users to truncate arbitrary files via the -logfile command line option, which overrides file system permissions because the server runs with the SYSPRV and BYPASS privileges.",CVE-2002-1513,0.00042,192.168.82.35,User
192.168.136.245,"nss_ldap earlier than 121, when run with nscd (name service caching daemon), allows remote attackers to cause a denial of service via a flood of LDAP requests.",CVE-2000-1045,0.00401,192.168.82.35,User
192.168.136.245,Format string vulnerability in RPC wall daemon (rpc.rwalld) for Solaris 2.5.1 through 8 allows remote attackers to execute arbitrary code via format strings in a message that is not properly provided to the syslog function when the wall command cannot be executed.,CVE-2002-0573,0.82733,192.168.82.35,User
192.168.136.245,"sendmessage.cgi in W3Mail 1.0.2, and possibly other CGI programs, allows remote attackers to execute arbitrary commands via shell metacharacters in any field of the 'Compose Message' page.",CVE-2001-1100,0.01582,192.168.82.35,User
192.168.136.245,Multilink PPP for ISDN dialup users in Ascend before 4.6 allows remote attackers to cause a denial of service via a spoofed endpoint identifier.,CVE-1999-1203,0.01179,192.168.199.173,User
192.168.136.245,The file upload capability in PHP versions 3 and 4 allows remote attackers to read arbitrary files by setting hidden form fields whose names match the names of internal PHP script variables.,CVE-2000-0860,0.00834,192.168.199.173,User
192.168.87.232,Buffer overflow in the HTML parser for Netscape 4.75 and earlier allows remote attackers to execute arbitrary commands via a long password value in a form field.,CVE-2000-1187,0.00936,192.168.58.129,User
192.168.87.232,Buffer overflow in mail included with SunOS 5.8 for x86 allows a local user to gain privileges via a long HOME environment variable.,CVE-2001-0686,0.00044,192.168.58.129,User
192.168.87.232,"mksnap_ffs in FreeBSD 5.1 and 5.2 only sets the snapshot flag when creating a snapshot for a file system, which causes default values for other flags to be used, possibly disabling security-critical settings and allowing a local user to bypass intended access restrictions.",CVE-2004-0099,0.00042,192.168.58.129,User
192.168.87.232,Microsoft SQL Server 2000 allows remote attackers to cause a denial of service via a malformed 0x08 packet that is missing a colon separator.,CVE-2002-0729,0.00817,192.168.58.129,User
192.168.6.130,Buffer overflow in the ISAPI DLL filter for Macromedia JRun 3.1 allows remote attackers to execute arbitrary code via a direct request to the filter with a long HTTP host header field in a URL for a .jsp file.,CVE-2002-0801,0.17401,192.168.199.173,User
192.168.6.130,"Race condition in signal handling of procmail 3.20 and earlier, when running setuid, allows local users to cause a denial of service or gain root privileges by sending a signal while a signal handling routine is already running.",CVE-2001-0905,0.00042,192.168.199.173,Root
192.168.6.130,Buffer overflow in xmcd 2.0p12 allows local users to gain access through an environmental variable.,CVE-1999-0318,0.00045,192.168.136.245,User
192.168.6.130,Lmail 2.7 and earlier allows local users to overwrite arbitrary files via a symlink attack on a temporary file.,CVE-2001-1085,0.00042,192.168.136.245,User
192.168.6.130,Multilink PPP for ISDN dialup users in Ascend before 4.6 allows remote attackers to cause a denial of service via a spoofed endpoint identifier.,CVE-1999-1203,0.01179,192.168.136.245,User
192.168.6.130,"nss_ldap earlier than 121, when run with nscd (name service caching daemon), allows remote attackers to cause a denial of service via a flood of LDAP requests.",CVE-2000-1045,0.00401,192.168.136.245,User
192.168.253.211,Becky! 2.00.05 and earlier can allow a remote attacker to gain additional privileges via a buffer overflow attack on long messages without newline characters.,CVE-2001-0611,0.00649,192.168.136.245,User
192.168.253.211,Buffer overflow in INN 2.2.1 and earlier allows remote attackers to cause a denial of service via a maliciously formatted article.,CVE-2000-0360,0.00649,192.168.136.245,User
192.168.253.211,Denial of service in Compaq Management Agents and the Compaq Survey Utility via a long string sent to port 2301.,CVE-1999-0772,0.00263,192.168.136.245,User
192.168.253.211,"BisonFTP V4R1 allows local users to access directories outside of their home directory by uploading .bdl files, which can then be linked to other directories.",CVE-2001-0765,0.00042,192.168.87.232,User
192.168.253.211,"Memory leak in Cisco Catalyst 4000, 5000, and 6000 series switches allows remote attackers to cause a denial of service via a series of failed telnet authentication attempts.",CVE-2001-0041,0.00755,192.168.87.232,User
192.168.253.211,"ISC BIND 9 before 9.2.1 allows remote attackers to cause a denial of service (shutdown) via a malformed DNS packet that triggers an error condition that is not properly handled when the rdataset parameter to the dns_message_findtype() function in message.c is not NULL, aka DoS_findtype.",CVE-2002-0400,0.11226,192.168.104.122,User
192.168.253.211,"Recourse ManTrap 1.6 sets up a chroot environment to hide the fact that it is running, but the inode number for the resulting ""/"" file system is higher than normal, which allows attackers to determine that they are in a chroot environment.",CVE-2000-1144,0.00074,192.168.104.122,Root
192.168.253.211,IBM Network Station Manager NetStation allows local users to gain privileges via a symlink attack.,CVE-2000-0027,0.00042,192.168.6.130,User
192.168.253.211,Buffer overflow in Apple QuickTime 5.0 ActiveX component allows remote attackers to execute arbitrary code via a long pluginspage field.,CVE-2002-0376,0.02388,192.168.6.130,User
192.168.253.211,The jj CGI program allows command execution via shell metacharacters.,CVE-1999-0260,0.00412,192.168.254.147,User
192.168.253.211,"Unknown vulnerability in autofs on AIX 4.3.0, when using executable maps, allows attackers to execute arbitrary commands as root, possibly related to ""string handling around how the executable map is called.""",CVE-2002-1548,0.00044,192.168.254.147,Root
192.168.253.211,Maxum Rumpus FTP Server 1.3.3 and 2.0.3 dev 3 allows a remote attacker to perform a denial of service (hang) by creating a directory name of a specific length.,CVE-2001-0646,0.0116,192.168.254.147,User
192.168.253.211,IBM Network Station Manager NetStation allows local users to gain privileges via a symlink attack.,CVE-2000-0027,0.00042,192.168.199.173,User
192.168.253.211,"Internet Explorer 5.5 and 6.0 allow remote attackers to read certain files via HTML that passes information from a frame in the client's domain to a frame in the web site's domain, a variant of the ""Frame Domain Verification"" vulnerability.",CVE-2001-0874,0.01517,192.168.199.173,User
192.168.253.211,"Buffer overflow in the parsing mechanism for ISS Internet Scanner 6.2.1, when using the license banner HTTP check, allows remote attackers to execute arbitrary code via a long web server response.",CVE-2002-1122,0.03476,192.168.199.173,User
192.168.253.211,Help and Support Center for Windows XP allows remote attackers to delete arbitrary files via a link to the hcp: protocol that accesses uplddrvinfo.htm.,CVE-2002-0974,0.0237,192.168.199.173,User
192.168.253.211,"Linux kernel, and possibly other operating systems, allows remote attackers to read portions of memory via a series of fragmented ICMP packets that generate an ICMP TTL Exceeded response, which includes portions of the memory in the response packet.",CVE-2002-0046,0.00513,192.168.199.173,User
192.168.82.35,"htsearch CGI program in htdig (ht://Dig) 3.1.5 and earlier allows remote attackers to use the -c option to specify an alternate configuration file, which could be used to (1) cause a denial of service (CPU consumption) by specifying a large file such as /dev/zero, or (2) read arbitrary files by uploading an alternate configuration file that specifies the target file.",CVE-2001-0834,0.01563,192.168.87.232,User
192.168.82.35,NetBSD 1.4.2 and earlier allows remote attackers to cause a denial of service by sending a packet with an unaligned IP timestamp option.,CVE-2000-0440,0.03175,192.168.87.232,User
192.168.82.35,"KAME-derived implementations of IPsec on NetBSD 1.5.2, FreeBSD 4.5, and other operating systems, does not properly consult the Security Policy Database (SPD), which could cause a Security Gateway (SG) that does not use Encapsulating Security Payload (ESP) to forward forged IPv4 packets.",CVE-2002-0414,0.00445,192.168.87.232,User
192.168.82.35,IRC Xchat client versions 1.4.2 and earlier allows remote attackers to execute arbitrary commands by encoding shell metacharacters into a URL which XChat uses to launch a web browser.,CVE-2000-0787,0.10989,192.168.87.232,User
192.168.82.35,Format string vulnerability in screen 3.9.5 and earlier allows local users to gain root privileges via format characters in the vbell_msg initialization variable.,CVE-2000-0901,0.00042,192.168.6.130,Root
192.168.82.35,"Race condition in signal handling routine in ftpd, allowing read/write arbitrary files.",CVE-1999-0035,0.00127,192.168.6.130,User
192.168.82.35,Buffer overflow in SysVInit in Red Hat Linux 5.1 and earlier allows local users to gain privileges.,CVE-1999-1329,0.00045,192.168.6.130,User
192.168.82.35,"Sdbsearch.cgi in SuSE Linux 6.0-7.2 could allow remote attackers to execute arbitrary commands by uploading a keylist.txt file that contains filenames with shell metacharacters, then causing the file to be searched using a .. in the HTTP referer (from the HTTP_REFERER variable) to point to the directory that contains the keylist.txt file.",CVE-2001-1130,0.04694,192.168.6.130,User
192.168.82.35,"Zope before 2.2.4 does not properly compute local roles, which could allow users to bypass specified access restrictions and gain privileges.",CVE-2001-0128,0.00059,192.168.6.130,User
192.168.82.35,"Phormation PHP script 0.9.1 and earlier allows remote attackers to execute arbitrary code by including files from remote web sites, using an HTTP request that modifies the phormationdir variable.",CVE-2001-1237,0.02557,192.168.249.119,User
192.168.82.35,Directory traversal vulnerability in McAfee ASaP VirusScan agent 1.0 allows remote attackers to read arbitrary files via a .. (dot dot) in the HTTP request.,CVE-2001-1144,0.01439,192.168.249.119,User
192.168.82.35,"Microsoft Virtual Machine (VM) up to and including build 5.0.3805 allows remote attackers to cause a denial of service (crash) in Internet Explorer via invalid handle data in a Java applet, aka ""Handle Validation Flaw.""",CVE-2002-0867,0.01115,192.168.249.119,User
192.168.82.35,PASV core dump in wu-ftpd daemon when attacker uses a QUOTE PASV command after specifying a username and password.,CVE-1999-0075,0.01598,192.168.253.211,User
192.168.82.35,"mksnap_ffs in FreeBSD 5.1 and 5.2 only sets the snapshot flag when creating a snapshot for a file system, which causes default values for other flags to be used, possibly disabling security-critical settings and allowing a local user to bypass intended access restrictions.",CVE-2004-0099,0.00042,192.168.253.211,User
192.168.82.35,"The default configuration of Big Brother 1.4h2 and earlier does not include proper access restrictions, which allows remote attackers to execute arbitrary commands by using bbd to upload a file whose extension will cause it to be executed as a CGI script by the web server.",CVE-2000-0639,0.01002,192.168.78.150,User
192.168.82.35,vold in Solaris 2.x allows local users to gain root access.,CVE-1999-0134,0.00044,192.168.78.150,Root
192.168.82.35,Directory traversal vulnerability in fsp before 2.81.b18 allows remote users to access files outside the FSP root directory.,CVE-2003-1022,0.01596,192.168.78.150,Root
192.168.82.35,Windows NT 4.0 SP4 and earlier allows local users to gain privileges by modifying the symbolic link table in the \?? object folder using a different case letter (upper or lower) to point to a different device.,CVE-1999-1317,0.00044,192.168.104.122,User
192.168.82.35,"The SPP_VerifyPVV function in nCipher payShield SPP library 1.3.12, 1.5.18 and 1.6.18 returns a Status_OK value even if the HSM returns a different status code, which could cause applications to make incorrect security-critical decisions, e.g. by accepting an invalid PIN number.",CVE-2004-0063,0.00486,192.168.104.122,User
192.168.82.35,Falcon web server 2.0.0.1020 and earlier allows remote attackers to bypass authentication and read restricted files via an extra / (slash) in the requested URL.,CVE-2002-0275,0.00319,192.168.104.122,User
192.168.82.35,"Cisco VPN 3000 Concentrator 3.6(Rel) and earlier, and 2.x.x, when configured to use internal authentication with group accounts and without any user accounts, allows remote VPN clients to log in using PPTP or IPSEC user authentication.",CVE-2002-1092,0.00428,192.168.104.122,User
192.168.82.35,"Expreserve, as used in vi and ex, allows local users to overwrite arbitrary files and gain root access.",CVE-1999-0132,0.00065,192.168.104.122,Root
192.168.104.122,The Nbase-Xyplex EdgeBlaster router allows remote attackers to cause a denial of service via a scan for the FormMail CGI program.,CVE-2000-0255,0.00268,192.168.87.232,User
192.168.104.122,"Oracle 9i Application Server 1.0.2 allows remote attackers to obtain the physical path of a file under the server root via a request for a non-existent .JSP file, which leaks the pathname in an error message.",CVE-2001-1372,0.10945,192.168.87.232,Root
192.168.104.122,The SSH authentication agent follows symlinks via a UNIX domain socket.,CVE-1999-0787,0.00051,192.168.87.232,User
192.168.104.122,Kerberos 4 allows remote attackers to obtain sensitive information via a malformed UDP packet that generates an error string that inadvertently includes the realm name and the last user.,CVE-1999-1099,0.00564,192.168.58.129,User
192.168.104.122,"htsearch CGI program in htdig (ht://Dig) 3.1.5 and earlier allows remote attackers to use the -c option to specify an alternate configuration file, which could be used to (1) cause a denial of service (CPU consumption) by specifying a large file such as /dev/zero, or (2) read arbitrary files by uploading an alternate configuration file that specifies the target file.",CVE-2001-0834,0.01563,192.168.58.129,User
192.168.104.122,The Microsoft Outlook mail client identifies the physical path of the sender's machine within a winmail.dat attachment to Rich Text Format (RTF) files.,CVE-2000-0753,0.00505,192.168.58.129,User
192.168.104.122,SmallHTTP 1.204 through 3.00 beta 8 allows remote attackers to cause a denial of service via multiple long URL requests.,CVE-2001-1251,0.0112,192.168.58.129,User
192.168.104.122,The SSH authentication agent follows symlinks via a UNIX domain socket.,CVE-1999-0787,0.00051,192.168.254.147,User
192.168.104.122,Buffer overflow in Webstar HTTP server allows remote attackers to cause a denial of service via a long GET request.,CVE-2000-0290,0.01179,192.168.254.147,User
192.168.104.122,"The getdbm procedure in ypxfrd allows local users to read arbitrary files, and remote attackers to read databases outside /var/yp, via a directory traversal and symlink attack on the domain and map arguments.",CVE-2002-1199,0.00552,192.168.78.150,User
192.168.104.122,"csstart program in iCal 2.1 Patch 2 uses relative pathnames to install the libsocket and libnsl libraries, which could allow the icsuser account to gain root privileges by creating a Trojan Horse library in the current or parent directory.",CVE-2000-1074,0.01501,192.168.78.150,Root
192.168.104.122,xpdf PDF viewer client earlier than 0.91 allows local users to overwrite arbitrary files via a symlink attack.,CVE-2000-0728,0.00042,192.168.78.150,User
192.168.104.122,authenticate.cgi CGI program in Aplio PRO allows remote attackers to execute arbitrary commands via shell metacharacters in the password parameter.,CVE-2000-0923,0.09243,192.168.78.150,User
192.168.104.122,"Oracle 9i Application Server 1.0.2 allows remote attackers to obtain the physical path of a file under the server root via a request for a non-existent .JSP file, which leaks the pathname in an error message.",CVE-2001-1372,0.10945,192.168.249.119,Root
192.168.104.122,Domain Enterprise Server Management System (DESMS) in HP-UX allows local users to gain privileges.,CVE-1999-0436,0.00042,192.168.249.119,User
192.168.104.122,ftpdownload in Computer Associates InoculateIT 6.0 allows a local attacker to overwrite arbitrary files via a symlink attack on /tmp/ftpdownload.log .,CVE-2001-0625,0.00042,192.168.253.211,User
192.168.104.122,"Identix BioLogon 2.03 and earlier does not lock secondary displays on a multi-monitor system running Windows 98 or ME, which allows an attacker with physical access to the system to bypass authentication through a secondary display.",CVE-2001-1116,0.00148,192.168.253.211,User
192.168.104.122,"Auction Weaver 1.0 through 1.04 does not properly validate the names of form fields, which allows remote attackers to delete arbitrary files and directories via a .. (dot dot) attack.",CVE-2000-0810,0.01221,192.168.136.245,User
192.168.104.122,htmlscript CGI program allows remote read access to files.,CVE-1999-0264,0.00613,192.168.136.245,User
192.168.104.122,"Cisco Virtual Private Network (VPN) Client software 2.x.x, and 3.x before 3.5.1C, does not properly verify that certificate DN fields match those of the certificate from the VPN Concentrator, which allows remote attackers to conduct man-in-the-middle attacks.",CVE-2002-1106,0.0036,192.168.199.173,User
192.168.104.122,authenticate.cgi CGI program in Aplio PRO allows remote attackers to execute arbitrary commands via shell metacharacters in the password parameter.,CVE-2000-0923,0.09243,192.168.199.173,User
192.168.104.122,The open() function in FreeBSD allows local attackers to write to arbitrary files.,CVE-1999-0322,0.0006,192.168.199.173,User
192.168.104.122,The NSAPI plugins for TGA and the Java Servlet proxy in HP-UX VVOS 10.24 and 11.04 allows an attacker to cause a denial of service (high CPU utilization).,CVE-2000-0965,0.0012,192.168.199.173,User
192.168.104.122,procfs in BSD systems allows local users to gain root privileges by modifying the /proc/pid/mem interface via a modified file descriptor for stderr.,CVE-2000-0094,0.00042,192.168.199.173,Root
192.168.254.147,"Internet Explorer 5.5 and 6.0 allow remote attackers to read certain files via HTML that passes information from a frame in the client's domain to a frame in the web site's domain, a variant of the ""Frame Domain Verification"" vulnerability.",CVE-2001-0874,0.01517,192.168.253.211,User
192.168.254.147,"OpenBSD 2.9 through 3.1 allows local users to cause a denial of service (resource exhaustion) and gain root privileges by filling the kernel's file descriptor table and closing file descriptors 0, 1, or 2 before executing a privileged process, which is not properly handled when OpenBSD fails to open an alternate descriptor.",CVE-2002-0766,0.00061,192.168.253.211,Root
192.168.254.147,"The HTTP server in Cisco 7xx series routers 3.2 through 4.2 is enabled by default, which allows remote attackers to change the router's configuration.",CVE-1999-0415,0.00677,192.168.253.211,User
192.168.254.147,Undocumented ColdFusion Markup Language (CFML) tags and functions in the ColdFusion Administrator allow users to gain additional privileges.,CVE-1999-0760,0.01393,192.168.253.211,User
192.168.254.147,Pegasus Mail 3.12 allows remote attackers to read arbitrary files via an embedded URL that calls the mailto: protocol with a -F switch.,CVE-2000-0930,0.02003,192.168.253.211,User
192.168.254.147,The AMaViS virus scanner 0.2.0-pre4 and earlier allows remote attackers to execute arbitrary commands as root via an infected mail message with shell metacharacters in the reply-to field.,CVE-1999-1512,0.01165,192.168.58.129,Root
